id,link,content,start_time,end_time,programme_id,programme_date
"w-Q9FnkB9v8V8UTR_sUv","https://www.rtve.es/v/5889655/?t=00h11m19s","El Partido Popular intenta justificar el no hacer ese cordón sanitario porque, en el fondo, cuenta con la ultraderecha para conformar sus propios gobiernos.",679,683,5889655,"2021-04-27T15:00:00+00:00"
"PJcVEXkBYZm1cCDlJHQd","https://www.rtve.es/v/5888674/?t=00h01m03s","El Partido Popular condena los hechos y llama a recuperar la convivencia, al igual que Ciudadanos.",63,65,5888674,"2021-04-26T15:00:00+00:00"
"fZcVEXkBYZm1cCDlJnQF","https://www.rtve.es/v/5888674/?t=00h08m52s","Condena también del presidente del Gobierno en Twitter y de la candidata del Partido Popular, que asegura que estos actos no tienen sentido en un país en libertad.",532,534,5888674,"2021-04-26T15:00:00+00:00"
"TdB8_HgBgrBJfNMhPy9H","https://www.rtve.es/v/5875214/?t=00h01m22s","El Partido Popular no se cree el sondeo, en su opinión el CIS no tiene ningún prestigio.",82,85,5875214,"2021-04-22T15:00:00+00:00"
"talY93gBk2RQE5bLLKgm","https://www.rtve.es/v/5865074/?t=00h20m46s","Acabamos de saber que el Tribunal Constitucional ha admitido a trámite los recursos presentados por el Partido Popular y Vox contra la ley de educación aprobada el pasado mes de diciembre.",1246,1249,5865074,"2021-04-21T15:00:00+00:00"
"qalY93gBk2RQE5bLGaaA","https://www.rtve.es/v/5859407/?t=00h11m03s","El Partido Popular deja clara su postura.",663,665,5859407,"2021-04-20T21:00:00+00:00"
"talY93gBk2RQE5bLGabD","https://www.rtve.es/v/5859407/?t=00h11m57s","-Creo que el Partido Popular, si me permiten esta expresión, está en redando con este tema del estado de alarma y no sabe ni lo que quiere.",717,720,5859407,"2021-04-20T21:00:00+00:00"
"PtslzngB1caK9CscSE1T","https://www.rtve.es/v/5852699/?t=00h22m18s","Desde la oposición, el Partido Popular critica que no se conozcan las medidas comprometidas con Bruselas para reformar las pensiones.",1338,1342,5852699,"2021-04-13T15:00:00+00:00"
"79slzngB1caK9CscgU44","https://www.rtve.es/v/5852001/?t=00h15m57s","Esta tarde el Partido Popular ha recurrido ya al Tribunal Constitucional la sentencia que sacó de su candidatura en Madrid al exdirigente de Ciudadanos Toni Cantó.",957,960,5852001,"2021-04-12T21:00:00+00:00"
"9rbXw3gBGqs3t8-hnNpG","https://www.rtve.es/v/5839061/?t=00h19m57s","La sentencia excluye a Toni Cantó y a Agustín Conde como candidatos de las listas del Partido Popular por Madrid.",1197,1200,5839061,"2021-04-11T21:00:00+00:00"
"BbbXw3gBGqs3t8-hnNuo","https://www.rtve.es/v/5839061/?t=00h21m33s","El Partido Socialista defiende su estrategia de vacunación y acusa al Partido Popular de ir a favor del virus.",1293,1297,5839061,"2021-04-11T21:00:00+00:00"
"qrbXw3gBGqs3t8-hqdzx","https://www.rtve.es/v/5838983/?t=00h18m12s","Con las vacunas como centro de la polémica política, El partido socialista acusa al partido popular de sembrar dudas sobre la vacuna y de ir, dicen, a favor del virus.",1092,1096,5838983,"2021-04-11T15:00:00+00:00"
"wwFktHgBAiKdl5oc7-HX","https://www.rtve.es/v/5836314/?t=00h15m56s","Las quejas llegan de las comunidades gobernadas por el Partido Popular, que acusan al Gobierno de dejarles desprotegidos.",956,960,5836314,"2021-04-07T21:00:00+00:00"
"0D8aqngBFxkM33Ehhnqo","https://www.rtve.es/v/5834297/?t=00h20m45s","-El Partido Popular entregará a Vox todo lo que sea necesario.",1245,1249,5834297,"2021-04-05T15:00:00+00:00"
"0T8aqngBFxkM33Ehhnqu","https://www.rtve.es/v/5834297/?t=00h20m48s","-Es un Partido Popular muy singular.",1248,1256,5834297,"2021-04-05T15:00:00+00:00"
"uNd9lXgBfuxOsOWky4EI","https://www.rtve.es/v/5833196/?t=00h15m19s","""Nosotros condenamos todos los ataques, vengan de donde vengan, pero sin embargo ha habido ataques a sedes del Partido Popular que Podemos no ha condenado"".",919,922,5833196,"2021-04-02T21:00:00+00:00"
"1MhYkHgBvUyswtsFub0z","https://www.rtve.es/v/5832665/?t=00h24m08s","Esos tres diputados expulsados del partido de Abascal fueron clave para que no prosperara la moción de censura que PSOE y Ciudadanos contra el popular López Miras.",1448,1452,5832665,"2021-04-01T15:00:00+00:00"
"Dny-e3gB_mDWbXx1yv7R","https://www.rtve.es/v/5829365/?t=00h20m32s","Y ese dilema se traduce hoy en más viviendo pública o más especulación"" El Partido Popular responde y acusa al PSOE de tener una doble moral.",1232,1237,5829365,"2021-03-28T21:00:00+00:00"
"kXy-e3gB_mDWbXx1kfun","https://www.rtve.es/v/5829237/?t=00h03m21s","El Partido Popular acusa al PSOE de doble moral por gobernar en España con Podemos.",201,205,5829237,"2021-03-28T15:00:00+00:00"
"nXy-e3gB_mDWbXx1l_yp","https://www.rtve.es/v/5829237/?t=00h29m23s","El Partido Popular acusa al PSOE de doble moral por gobernar en España con Podemos.",1763,1766,5829237,"2021-03-28T15:00:00+00:00"
"p3y-e3gB_mDWbXx1l_zf","https://www.rtve.es/v/5829237/?t=00h30m20s","Para el Partido Popular, el PSOE tiene doble moral.",1820,1824,5829237,"2021-03-28T15:00:00+00:00"
"YdqDbHgBM54i-KjYLvbS","https://www.rtve.es/v/5827309/?t=00h25m00s","Ha asegurado hoy ante el juez del caso Púnica que nunca ha dado dinero al Partido Popular.",1500,1503,5827309,"2021-03-25T15:00:00+00:00"
"etqDbHgBM54i-KjYQPdD","https://www.rtve.es/v/5826598/?t=00h01m17s","-No ha habido caja B del Partido Popular y por supuesto yo no he triturado lo que nunca tuve en mis manos.",77,80,5826598,"2021-03-24T21:00:00+00:00"
"ytqDbHgBM54i-KjYQff7","https://www.rtve.es/v/5826598/?t=00h10m06s","-Da pena ver al Partido Popular liderado por usted.",606,610,5826598,"2021-03-24T21:00:00+00:00"
"xtqDbHgBM54i-KjYU_ne","https://www.rtve.es/v/5826314/?t=00h17m16s","El Partido Popular ha acusado presidente del gobierno, de intentar acabar con ellos en Murcia, Castilla y León y Madrid.",1036,1040,5826314,"2021-03-24T15:00:00+00:00"
"4tqCbHgBM54i-KjY_fPF","https://www.rtve.es/v/5825620/?t=00h03m26s","La caja paralela o la caja B del Partido Popular no existe, no era del partido popular, repito.",206,210,5825620,"2021-03-23T21:00:00+00:00"
"49qCbHgBM54i-KjY_fPN","https://www.rtve.es/v/5825620/?t=00h03m31s","Sería de la persona que la hizo, pero no era del Partido Popular.",211,216,5825620,"2021-03-23T21:00:00+00:00"
"qdqDbHgBM54i-KjYA_RK","https://www.rtve.es/v/5825620/?t=00h25m11s","-Yo jamás he conocido, manejado ni creado ninguna caja B. -No soy ni el único Javier que aparece en los papeles ni el único Javier del Partido Popular.",1511,1517,5825620,"2021-03-23T21:00:00+00:00"
"hok0YngBMOeau0gG98k8","https://www.rtve.es/v/5825355/?t=00h21m25s","No soy el único Javier que aparece en los papeles ni el único Javier del Partido Popular.",1285,1290,5825355,"2021-03-23T15:00:00+00:00"
"0ok1YngBMOeau0gGEMpV","https://www.rtve.es/v/5824628/?t=00h02m47s","Es aquí, donde el Partido Popular inventó la caja B, por eso esta moción de censura.",167,171,5824628,"2021-03-22T21:00:00+00:00"
"LZIRXXgB3X49FN8d-uoS","https://www.rtve.es/v/5824310/?t=00h16m47s","Que por higiene democrática y por dignidad propia ante la campaña del partido popular para fagocitares rompan todos sus pactos de gobiernos con el PP en aytos y CCAA empezando por Castilla y león.",1007,1011,5824310,"2021-03-22T15:00:00+00:00"
"_JIRXXgB3X49FN8dsuWP","https://www.rtve.es/v/5823699/?t=00h01m49s","El Partido Popular cree que Iglesias debería dejar el acta de diputado.",109,114,5823699,"2021-03-21T21:00:00+00:00"
"BEPnV3gBYv1v9zqFX298","https://www.rtve.es/v/5823539/?t=00h01m40s","El Partido Popular cree que Iglesias debería dejar el acta de diputado.",100,105,5823539,"2021-03-21T15:00:00+00:00"
"CyLDUngBR0U0X5aGr7XX","https://www.rtve.es/v/5823285/?t=00h13m14s","El partido popular tira de ironía.",794,797,5823285,"2021-03-20T21:00:00+00:00"
"X8ScTXgBxfAj-snAxvnx","https://www.rtve.es/v/5822230/?t=00h20m44s","-El Partido Popular se ha escorado hacia la ultraderecha y, además, está haciendo de Madrid un laboratorio de pruebas del trumpismo.",1244,1247,5822230,"2021-03-19T07:30:00+00:00"
"cMScTXgBxfAj-snAx_k4","https://www.rtve.es/v/5822230/?t=00h22m34s","-Esta ley solamente podría salir si se sigue adelante con el incumplimiento del acuerdo de Gobierno con el apoyo del Partido Popular.",1354,1358,5822230,"2021-03-19T07:30:00+00:00"
"apIRXXgB3X49FN8d8OhW","https://www.rtve.es/v/5822140/?t=00h20m42s","-El Partido Popular se ha escorado hacia la ultraderecha y, además, está haciendo de Madrid un laboratorio de pruebas del trumpismo.",1242,1246,5822140,"2021-03-18T21:00:00+00:00"
"e5IRXXgB3X49FN8d8Oiy","https://www.rtve.es/v/5822140/?t=00h22m33s","-Esta ley solamente podría salir si se sigue adelante con el incumplimiento del acuerdo de Gobierno con el apoyo del Partido Popular.",1353,1356,5822140,"2021-03-18T21:00:00+00:00"
"-Ul2SHgBWxfccRy2Rg0c","https://www.rtve.es/v/5821828/?t=00h36m22s","Es uno de los proyectos estrellas del PSOE. 202 votos a favor, todos los grupos es este el Partido Popular y vos.",2182,2185,5821828,"2021-03-18T15:00:00+00:00"
"5Ul2SHgBWxfccRy2dg5T","https://www.rtve.es/v/5821145/?t=00h03m15s","Luis Bárcenas ha apuntado que Mariano Rajoy estaba tras la operación Kitchen, montada presuntamente desde Interior para extraer información al extesorero que pudiera comprometer al Partido Popular.",195,197,5821145,"2021-03-17T21:00:00+00:00"
"ZEl2SHgBWxfccRy2eA-8","https://www.rtve.es/v/5821145/?t=00h15m50s","-Como buen secretario general del Partido Popular, se ha dedicado a comprase diputados de Ciudadanos.",950,954,5821145,"2021-03-17T21:00:00+00:00"
"hWlQQ3gB1_ooFVKqZPY3","https://www.rtve.es/v/5820885/?t=00h07m47s","""Como bien secretario general del Partido Popular, se ha dedicado a comprarse diputados de Ciudadanos.",467,470,5820885,"2021-03-17T15:00:00+00:00"
"nWlQQ3gB1_ooFVKqovhn","https://www.rtve.es/v/5820044/?t=00h16m50s","Esa división de la izquierda se percibe como una buena noticia en el otro bloque en el que están Partido Popular, Vox y Ciudadanos.",1010,1015,5820044,"2021-03-16T21:00:00+00:00"
"KqIpPngBStd6-SGMnGuG","https://www.rtve.es/v/5819126/?t=00h07m47s","Re junto a l siglas del Partido Popular, se aglutinaron todos los votos.",467,471,5819126,"2021-03-15T21:00:00+00:00"
"3NUCOXgB78TwBpLk1NKv","https://www.rtve.es/v/5818809/?t=00h19m53s","Desconocía y desconozco la existencia de una caja B, ni de dinero B en el Partido Popular en ningún momento.",1193,1196,5818809,"2021-03-15T15:00:00+00:00"
"WdUCOXgB78TwBpLk8tSF","https://www.rtve.es/v/5818084/?t=00h07m59s","El Partido Popular insiste: sus puertas están abiertas para unir a ambos partidos.",479,483,5818084,"2021-03-14T21:00:00+00:00"
"XtUCOXgB78TwBpLk8tSh","https://www.rtve.es/v/5818084/?t=00h08m27s","Horas después en una entrevista en El Mundo anuncia que se suma al Partido Popular.",507,511,5818084,"2021-03-14T21:00:00+00:00"
"YdUCOXgB78TwBpLk8tS0","https://www.rtve.es/v/5818084/?t=00h08m48s","La puerta el Partido Popular deben estar abiertas.",528,530,5818084,"2021-03-14T21:00:00+00:00"
"YtUCOXgB78TwBpLk8tS5","https://www.rtve.es/v/5818084/?t=00h08m52s","Edmundo Bal acusa al partido popular de montar, dice, una operacion para destruir a Ciudadanos.",532,536,5818084,"2021-03-14T21:00:00+00:00"
"G8vaM3gB0meBbj4FbbFU","https://www.rtve.es/v/5817971/?t=00h07m07s","Mientras los militantes socialistas de la Región de Murcia votanhoy si apoyan la iniciativa para conformar el nuevo gobierno Entre ellos el secretario general de los socialistas murcianos Diego Conesa, que reafirma la moción y anunciará el martes los detalles de su acuerdo con Ciudadanos, según ha dicho, por el cambio, la regeneración y la estabilidad de la región El Partido Popular de la Región de Murcia, ha incumplido una vez más los estatutos de su partido.",427,432,5817971,"2021-03-14T15:00:00+00:00"
"IsvaM3gB0meBbj4FbbGD","https://www.rtve.es/v/5817971/?t=00h08m21s","Y horas después, en una entrevista en El Mundo, anuncia que se suma al Partido Popular.",501,504,5817971,"2021-03-14T15:00:00+00:00"
"JcvaM3gB0meBbj4FbbGW","https://www.rtve.es/v/5817971/?t=00h08m36s","La candidata de Ciudadanos en la moción de Murcia, La candidata de Ciudadanos en la moción de Murcia, Ana Martínez Vidal, señala directamente a Hervías como responsable del transfuguismo en la región y Edmundo Bal acusa al Partido Popular de montar, dice, una operación para destruir a Ciudadanos.",516,518,5817971,"2021-03-14T15:00:00+00:00"
"LViQKXgB4HE0IwZJ9JjZ","https://www.rtve.es/v/5817482/?t=00h06m28s","Tras un pacto alcanzado entre el Partido Popular y ciudadanos.",388,392,5817482,"2021-03-12T21:00:00+00:00"
"A1iRKXgB4HE0IwZJP5wa","https://www.rtve.es/v/5816428/?t=00h09m19s","Era la conversación informal entre la vicealcaldesa de Madrid de Ciudadanos y el presidente del Partido Popular que ha captado un micrófono de TVE.",559,561,5816428,"2021-03-11T21:00:00+00:00"
"YN5oJHgBndVvEJEFiB1S","https://www.rtve.es/v/5816201/?t=00h15m42s","Entre el Partido Popular y ciudadanos.",942,944,5816201,"2021-03-11T15:00:00+00:00"
"R95oJHgBndVvEJEFcxsC","https://www.rtve.es/v/5815371/?t=00h02m20s","El Partido Popular abre sus puertas a todos los dirigentes, Está por ver si estos movimientos, es un cambio de alianzas en el congreso.",140,143,5815371,"2021-03-10T21:00:00+00:00"
"SN5oJHgBndVvEJEFcxsI","https://www.rtve.es/v/5815371/?t=00h02m39s","Si el Partido Socialista mira ciudadanos. antes que a los socios de investidura. y como afecta entre las conversaciones del Partido Popular y el Partido Socialista, para renovar el poder judicial El Partido Popular abre sus puertas a todos los dirigentes, simpatizantes, militantes y a todos aquellos que se han sentido defraudados por esta decisión arbitraria, injusta e irresponsable de Inés Arrimadas.",159,162,5815371,"2021-03-10T21:00:00+00:00"
"kN5oJHgBndVvEJEFdBut","https://www.rtve.es/v/5815371/?t=00h11m23s","Allí gobierna el Partido Popular, con Ciudadanos.",683,686,5815371,"2021-03-10T21:00:00+00:00"
"t95oJHgBndVvEJEFdRt6","https://www.rtve.es/v/5815371/?t=00h16m43s","Teodoro Egea. habla de operación clandestina y afrenta política hoy el Partido Popular quiera hacer un llamamiento. que es ese llamamiento de abrir las puertas a todos aquellos que no se sienten identificados con lo que está ocurriendo hoy, del partido Ciudadanos o de cualquier otro partido.",1003,1006,5815371,"2021-03-10T21:00:00+00:00"
"xd5oJHgBndVvEJEFdRvC","https://www.rtve.es/v/5815371/?t=00h18m43s","La lectura que hacen. es que el PSOE sale fortalecido. y que el Partido Popular ha unido su destino a la ultraderecha remarcan que la coalición de Sánchez e Iglesias.",1123,1125,5815371,"2021-03-10T21:00:00+00:00"
"zN5oJHgBndVvEJEFdRvm","https://www.rtve.es/v/5815371/?t=00h19m58s","Como afecta a las ya complicadas negociaciones, entre el gobierno y el Partido Popular. para renovar órganos institucionales.",1198,1202,5815371,"2021-03-10T21:00:00+00:00"
"iKpDH3gBJ08gZNOFDPKl","https://www.rtve.es/v/5815068/?t=00h17m29s","Pero, visto lo visto, tendremos que volver administrarla una vezmás un gobierno del Partido Popular.",1049,1053,5815068,"2021-03-10T15:00:00+00:00"
