id,phrases
0,"1.1 Queremos dejar atrás la pandemia con sensatez y evidencia científica, apostando por la apertura de la actividad con la máxima normalidad posible, alejados de prohibiciones arbitrarias y de la irresponsabilidad sanitaria. Trabajaremos con todos los Ayuntamientos de la Comunidad de Madrid para ampliar los espacios de terrazas al máximo y cederemos espacios públicos al aire libre para la celebración de eventos culturales, deportivos y de espectáculos. Nuestra región merece volver a la vida sin poner en riesgo la vida de sus ciudadanos. 1.2 Vacunaremos 24/7, incluyendo festivos y fines de semana. Madrid debe ser capaz de acelerar el proceso de vacunación consiguiendo administrar el 100% de las vacunas que recibe. 1.3 Pondremos en marcha nuestro Plan Integral de Rescate de 1.000 millones de euros en ayudas directas a empresas, autónomos, pymes y familias que impulsamos desde la Consejería de Economía de Cs y que el adelanto electoral dejó bloqueado. Más de 600 millones de euros para pymes y autónomos, con 235 millones de ayudas directas a fondo perdido 85 millones de euros a fondo perdido para la hostelería 100 millones de euros para la transformación digital de comercios y restauración 100 millones para la transformación y activación de las zonas industriales madrileñas 1.4 Las farmacias, clínicas odontológicas y clínicas veterinarias podrán vender y realizar test de detección COVID-19 por PCR, antígenos y anticuerpos a todos los ciudadanos, sin importar la zona en la que residan. Los resultados de estos test deberán comunicarse, de acuerdo a la legislación vigente, a las autoridades sanitarias para mejorar la información general sobre la situación epidemiológica de nuestro país. 1.5 Exigiremos al Gobierno central que prorrogue los ERTE y las ayudas a empresas y trabajadores hasta que se elimine cualquier tipo de restricción a la movilidad o a la actividad comercial. No vamos a tolerar que se abandone a los negocios que han conseguido mantener la actividad durante el último año, sobre todo en aquellos sectores que más tardarán en recuperar la actividad. 1.6 Incentivaremos la reconversión, formación y vuelta a la actividad de los trabajadores en ERTE. El Gobierno de Sánchez ha abandonado a los trabajadores en ERTE y no les ha ofrecido la oportunidad de formarse en nuevas habilidades, contenidos o incluso preparar su reconversión hacia otros sectores para mejorar su empleabilidad. Desde Cs nos aseguraremos de dotar a los trabajadores en ERTE de todas las herramientas formativas necesarias para asegurar su empleabilidad. 1.7 Facilitaremos que los comerciantes y hosteleros puedan mantener abiertos los interiores de sus negocios facilitándoles medidores de CO2 para asegurar una ventilación adecuada. Además, suprimiremos tasas y trámites al Ocio Nocturno para que el sector pueda sobrevivir hasta la reapertura de los locales o, si lo prefieren, puedan reconvertir sus negocios. 1.8 Seguiremos apoyando y simplificaremos los trámites al sector de la venta ambulante, muy afectado por la pandemia. Aprobaremos una Ley marco de venta ambulante o no sedentaria que establezca criterios claros y elimine burocracia para el desarrollo de esta actividad en todo el territorio madrileño. 1.9 Garantizaremos el uso eficiente y un reparto objetivo e independiente de los fondos europeos en la Comunidad de Madrid a través de la colaboración de la Administración autonómica, el sector privado y la sociedad civil. Haremos lo que el Gobierno de España se ha negado a hacer. Apostaremos por maximizar la rentabilidad social y económica de los proyectos a través de la evaluación ex ante de los mismos, el seguimiento en la implementación y la evaluación de impacto posterior con una clara estrategia de colaboración con el sector privado. 1.10 Exigiremos al Gobierno de España un calendario de hitos de vacunación para dar certidumbre sobre la vuelta a la normalidad. A medida que avance la inmunización en la población, deberán reevaluar las restricciones a la movilidad, la actividad comercial, así como la obligatoriedad de la mascarilla en espacios abiertos, el aumento de los aforos en interiores y exteriores y el aumento del número de personas no convivientes en reuniones, entre otras, siguiendo criterios objetivos, técnicos y transparentes. 1.11 Garantizaremos la transparencia durante todo el proceso de vacunación y sancionaremos a quienes se salten los protocolos en beneficio propio. Exigiremos a todas las formaciones políticas asuman un compromiso ético para pedir la dimisión o destituir automáticamente a cualquier cargo político que incumpla los protocolos de vacunación con el objetivo de obtener una vacuna en beneficio propio o de los suyos. 1.12 Combatiremos las tesis anti-vacunación alejadas del rigor científico y promoveremos la vacunación con campañas específicas. El próximo gobierno regional suscribirá el fomento de la vacunación y combatirá los discursos anti-vacunación que pueden poner en riesgo la salud de los madrileños. Apostaremos, asimismo, por reivindicar el rigor científico frente a las teorías de la conspiración."
1,"1.1 Queremos dejar atrás la pandemia con sensatez y evidencia científica, apostando por la apertura de la actividad con la máxima normalidad posible, alejados de prohibiciones arbitrarias y de la irresponsabilidad sanitaria. Trabajaremos con todos los Ayuntamientos de la Comunidad de Madrid para ampliar los espacios de terrazas al máximo y cederemos espacios públicos al aire libre para la celebración de eventos culturales, deportivos y de espectáculos. Nuestra región merece volver a la vida sin poner en riesgo la vida de sus ciudadanos."
2,"1.2 Vacunaremos 24/7, incluyendo festivos y fines de semana. Madrid debe ser capaz de acelerar el proceso de vacunación consiguiendo administrar el 100% de las vacunas que recibe."
3,"1.3 Pondremos en marcha nuestro Plan Integral de Rescate de 1.000 millones de euros en ayudas directas a empresas, autónomos, pymes y familias que impulsamos desde la Consejería de Economía de Cs y que el adelanto electoral dejó bloqueado. Más de 600 millones de euros para pymes y autónomos, con 235 millones de ayudas directas a fondo perdido 85 millones de euros a fondo perdido para la hostelería 100 millones de euros para la transformación digital de comercios y restauración 100 millones para la transformación y activación de las zonas industriales madrileñas"
4,"Más de 600 millones de euros para pymes y autónomos, con 235 millones de ayudas directas a fondo perdido"
5,85 millones de euros a fondo perdido para la hostelería
6,100 millones de euros para la transformación digital de comercios y restauración
7,100 millones para la transformación y activación de las zonas industriales madrileñas
8,"1.4 Las farmacias, clínicas odontológicas y clínicas veterinarias podrán vender y realizar test de detección COVID-19 por PCR, antígenos y anticuerpos a todos los ciudadanos, sin importar la zona en la que residan. Los resultados de estos test deberán comunicarse, de acuerdo a la legislación vigente, a las autoridades sanitarias para mejorar la información general sobre la situación epidemiológica de nuestro país."
9,"1.5 Exigiremos al Gobierno central que prorrogue los ERTE y las ayudas a empresas y trabajadores hasta que se elimine cualquier tipo de restricción a la movilidad o a la actividad comercial. No vamos a tolerar que se abandone a los negocios que han conseguido mantener la actividad durante el último año, sobre todo en aquellos sectores que más tardarán en recuperar la actividad."
10,"1.6 Incentivaremos la reconversión, formación y vuelta a la actividad de los trabajadores en ERTE. El Gobierno de Sánchez ha abandonado a los trabajadores en ERTE y no les ha ofrecido la oportunidad de formarse en nuevas habilidades, contenidos o incluso preparar su reconversión hacia otros sectores para mejorar su empleabilidad. Desde Cs nos aseguraremos de dotar a los trabajadores en ERTE de todas las herramientas formativas necesarias para asegurar su empleabilidad."
11,"1.7 Facilitaremos que los comerciantes y hosteleros puedan mantener abiertos los interiores de sus negocios facilitándoles medidores de CO2 para asegurar una ventilación adecuada. Además, suprimiremos tasas y trámites al Ocio Nocturno para que el sector pueda sobrevivir hasta la reapertura de los locales o, si lo prefieren, puedan reconvertir sus negocios."
12,"1.8 Seguiremos apoyando y simplificaremos los trámites al sector de la venta ambulante, muy afectado por la pandemia. Aprobaremos una Ley marco de venta ambulante o no sedentaria que establezca criterios claros y elimine burocracia para el desarrollo de esta actividad en todo el territorio madrileño."
13,"1.9 Garantizaremos el uso eficiente y un reparto objetivo e independiente de los fondos europeos en la Comunidad de Madrid a través de la colaboración de la Administración autonómica, el sector privado y la sociedad civil. Haremos lo que el Gobierno de España se ha negado a hacer. Apostaremos por maximizar la rentabilidad social y económica de los proyectos a través de la evaluación ex ante de los mismos, el seguimiento en la implementación y la evaluación de impacto posterior con una clara estrategia de colaboración con el sector privado."
14,"1.10 Exigiremos al Gobierno de España un calendario de hitos de vacunación para dar certidumbre sobre la vuelta a la normalidad. A medida que avance la inmunización en la población, deberán reevaluar las restricciones a la movilidad, la actividad comercial, así como la obligatoriedad de la mascarilla en espacios abiertos, el aumento de los aforos en interiores y exteriores y el aumento del número de personas no convivientes en reuniones, entre otras, siguiendo criterios objetivos, técnicos y transparentes."
15,1.11 Garantizaremos la transparencia durante todo el proceso de vacunación y sancionaremos a quienes se salten los protocolos en beneficio propio. Exigiremos a todas las formaciones políticas asuman un compromiso ético para pedir la dimisión o destituir automáticamente a cualquier cargo político que incumpla los protocolos de vacunación con el objetivo de obtener una vacuna en beneficio propio o de los suyos.
16,"1.12 Combatiremos las tesis anti-vacunación alejadas del rigor científico y promoveremos la vacunación con campañas específicas. El próximo gobierno regional suscribirá el fomento de la vacunación y combatirá los discursos anti-vacunación que pueden poner en riesgo la salud de los madrileños. Apostaremos, asimismo, por reivindicar el rigor científico frente a las teorías de la conspiración."
17,"2.1 Mejoraremos la eficiencia del Servicio Madrileño de Salud mediante una auditoría externa e independiente. Nos aseguraremos de que cada euro destinado a la salud y el bienestar de los madrileños se traduzca en una mejora de la calidad asistencial. 2.2 Consolidaremos la incorporación de los 10.000 nuevos profesionales sanitarios que han reforzado el servicio madrileño de salud durante la pandemia. Es fundamental mantener a los profesionales que han reforzado el sistema sanitarios durante el último año para asegurar una atención de calidad y reducir la ratio de profesionales por ciudadanos. Pondremos especial atención en el refuerzo de la Atención Primaria. 2.3 Reforzaremos la inversión destinada a la Atención Primaria haciendo una apuesta integral por este tipo de centros. Los centros que prestan este tipo de atención se han convertido en esenciales para la pandemia, así como pieza clave en el sistema madrileño de salud para evitar el colapso hospitalario. Dotaremos de mayor presupuesto y de los recursos necesarios para avanzar paulatinamente a una atención 100% personalizada, siempre en colaboración con el resto de servicios sanitarios, con el objetivo de reducir listas de espera para visitas médicas que no deben aplazarse innecesariamente. 2.4 Profesionalizaremos la gestión hospitalaria de Madrid, evitando casos de enchufismo y amiguismo y apostando por poner al paciente en el centro del SERMAS. Aseguraremos que el SERMAS se gestiona de una forma transparente, con rendición de cuentas y profesionalizada para evitar fallos en la gestión debido a la politización. 2.5 Efectuaremos una revisión de todas las infraestructuras sanitarias para detectar necesidades asistenciales y de mejoras de cara a la próxima legislatura. Dedicaremos estos dos años a hacer una evaluación de los centros sanitarios, hospitales y otros centros asistenciales de la Comunidad de Madrid con el objetivo de detectar posibilidades de mejora y reparación. 2.6 Estableceremos un sistema de guarderías en los hospitales para mejorar la conciliación de profesionales sanitarios, de administración y de pacientes y visitantes. Apostaremos por la conciliación, también para los profesionales sanitarios de los centros hospitalarios, los pacientes y visitantes. Para ello, crearemos una red de guarderías y servicios de cuidados infantiles. 2.7 Acabaremos con la precariedad y la temporalidad de los profesionales sanitarios del Servicio Madrileño de Salud (SERMAS). Revisaremos el sistema de retribuciones del personal sanitario del SERMAS y acabaremos con el encadenamiento de contratos temporales para cubrir servicios y necesidades estructurales en nuestros centros de atención sanitaria y eliminar el agravio comparativo de nuestros facultativos respecto a los del resto de España. 2.8 Reforzaremos la formación del personal sanitario y administrativo en inteligencia emocional, atención al paciente y no discriminación. Mejoraremos la calidad de la atención sanitaria al paciente y a sus acompañantes, asegurando asimismo formación para detectar posibles casos de violencia machista, violencia contra menores u otro tipo de actuaciones que pudieran suponer un delito. 2.9 Reforzaremos la figura del profesional sanitario para proteger su labor y su autoridad. La Comunidad de Madrid sigue siendo una de las regiones españolas que registra más agresiones a profesionales sanitarios. Por ello, mejoraremos el marco normativo que ampara a estos profesionales para que reconozca mejor su autoridad y les proteja mejor de quienes ejerzan la violencia, el acoso o vejaciones contra ellos. 2.10 Desarrollaremos protocolos de mejora en el diagnóstico rápido y la detección temprana, con especial atención a las enfermedades degenerativas. La prevención y la detección temprana pueden suponer importantes mejoras en el bienestar de todos ellos, por lo que reforzaremos los mecanismos de diagnóstico para que estas patologías no supongan un reto adicional para familias y pacientes. 2.11 Impulsaremos la educación en salud para informar sobre el peligro de las pseudoterapias y para acabar con los prejuicios y la discriminación contra pacientes de determinadas enfermedades. Apostaremos por la información veraz y accesible con el objetivo de erradicar la discriminación que sufren pacientes de enfermedades como el VIH, la Hepatitis C y otras patologías. 2.12 Ampliaremos progresivamente la cobertura gratuita del dentista a toda la población. Potenciaremos la salud bucodental partiendo del Programa de Atención Dental Infanto/juvenil a niños de 6 a 16 años existente en Madrid para cubrir cada vez más grupos de población. Valoraremos la inclusión de prestaciones como ortodoncias o dentaduras."
18,2.1 Mejoraremos la eficiencia del Servicio Madrileño de Salud mediante una auditoría externa e independiente. Nos aseguraremos de que cada euro destinado a la salud y el bienestar de los madrileños se traduzca en una mejora de la calidad asistencial.
19,2.2 Consolidaremos la incorporación de los 10.000 nuevos profesionales sanitarios que han reforzado el servicio madrileño de salud durante la pandemia. Es fundamental mantener a los profesionales que han reforzado el sistema sanitarios durante el último año para asegurar una atención de calidad y reducir la ratio de profesionales por ciudadanos. Pondremos especial atención en el refuerzo de la Atención Primaria.
20,"2.3 Reforzaremos la inversión destinada a la Atención Primaria haciendo una apuesta integral por este tipo de centros. Los centros que prestan este tipo de atención se han convertido en esenciales para la pandemia, así como pieza clave en el sistema madrileño de salud para evitar el colapso hospitalario. Dotaremos de mayor presupuesto y de los recursos necesarios para avanzar paulatinamente a una atención 100% personalizada, siempre en colaboración con el resto de servicios sanitarios, con el objetivo de reducir listas de espera para visitas médicas que no deben aplazarse innecesariamente."
21,"2.4 Profesionalizaremos la gestión hospitalaria de Madrid, evitando casos de enchufismo y amiguismo y apostando por poner al paciente en el centro del SERMAS. Aseguraremos que el SERMAS se gestiona de una forma transparente, con rendición de cuentas y profesionalizada para evitar fallos en la gestión debido a la politización."
22,"2.5 Efectuaremos una revisión de todas las infraestructuras sanitarias para detectar necesidades asistenciales y de mejoras de cara a la próxima legislatura. Dedicaremos estos dos años a hacer una evaluación de los centros sanitarios, hospitales y otros centros asistenciales de la Comunidad de Madrid con el objetivo de detectar posibilidades de mejora y reparación."
23,"2.6 Estableceremos un sistema de guarderías en los hospitales para mejorar la conciliación de profesionales sanitarios, de administración y de pacientes y visitantes. Apostaremos por la conciliación, también para los profesionales sanitarios de los centros hospitalarios, los pacientes y visitantes. Para ello, crearemos una red de guarderías y servicios de cuidados infantiles."
24,2.7 Acabaremos con la precariedad y la temporalidad de los profesionales sanitarios del Servicio Madrileño de Salud (SERMAS). Revisaremos el sistema de retribuciones del personal sanitario del SERMAS y acabaremos con el encadenamiento de contratos temporales para cubrir servicios y necesidades estructurales en nuestros centros de atención sanitaria y eliminar el agravio comparativo de nuestros facultativos respecto a los del resto de España.
25,"2.8 Reforzaremos la formación del personal sanitario y administrativo en inteligencia emocional, atención al paciente y no discriminación. Mejoraremos la calidad de la atención sanitaria al paciente y a sus acompañantes, asegurando asimismo formación para detectar posibles casos de violencia machista, violencia contra menores u otro tipo de actuaciones que pudieran suponer un delito."
26,"2.9 Reforzaremos la figura del profesional sanitario para proteger su labor y su autoridad. La Comunidad de Madrid sigue siendo una de las regiones españolas que registra más agresiones a profesionales sanitarios. Por ello, mejoraremos el marco normativo que ampara a estos profesionales para que reconozca mejor su autoridad y les proteja mejor de quienes ejerzan la violencia, el acoso o vejaciones contra ellos."
27,"2.10 Desarrollaremos protocolos de mejora en el diagnóstico rápido y la detección temprana, con especial atención a las enfermedades degenerativas. La prevención y la detección temprana pueden suponer importantes mejoras en el bienestar de todos ellos, por lo que reforzaremos los mecanismos de diagnóstico para que estas patologías no supongan un reto adicional para familias y pacientes."
28,"2.11 Impulsaremos la educación en salud para informar sobre el peligro de las pseudoterapias y para acabar con los prejuicios y la discriminación contra pacientes de determinadas enfermedades. Apostaremos por la información veraz y accesible con el objetivo de erradicar la discriminación que sufren pacientes de enfermedades como el VIH, la Hepatitis C y otras patologías."
29,2.12 Ampliaremos progresivamente la cobertura gratuita del dentista a toda la población. Potenciaremos la salud bucodental partiendo del Programa de Atención Dental Infanto/juvenil a niños de 6 a 16 años existente en Madrid para cubrir cada vez más grupos de población. Valoraremos la inclusión de prestaciones como ortodoncias o dentaduras.
30,"Impuestos bajos y eficiencia del gasto público 3.1 Defendemos nuestro modelo de fiscalidad e impuestos bajos para que los madrileños no paguen ni un euro más en impuestos. Apostaremos por un gasto público más eficiente, con menos duplicidades y menos barreras burocráticas para asegurar la calidad de nuestro sistema de bienestar sin meter la mano en el bolsillo a los ciudadanos. Seremos el escudo de los madrileños frente a los sablazos de Sánchez y Podemos a la clase media. 3.2 Exigiremos la reforma del sistema de financiación autonómica defendiendo un nuevo modelo más justo y transparente. Es fundamental que el sistema de financiación garantice un reparto equitativo de los recursos entre todas las Comunidades Autónomas que permita ofrecer unos servicios de calidad para los madrileños. 3.3 Impulsaremos el establecimiento de un sistema de “recompensas tributarias” para incentivar determinados comportamientos con el fin de acabar con la economía sumergida. Ciertas acciones, como la exigencia de factura en servicios prestados en el ámbito doméstico y de pequeñas ejecuciones de obra, serán promovidas con incentivos que redundarán en un ahorro para el destinatario, para que deje de salir más a cuenta defraudar que cumplir. 3.4 Implementaremos incentivos fiscales para acabar con la precariedad de las empleadas del hogar. Regularemos un incentivo fiscal para los empleadores a la contratación reglada de empleados de hogar con el fin de aflorar economía sumergida en el ámbito del servicio doméstico y mitigar la precarización de este colectivo."
31,"3.1 Defendemos nuestro modelo de fiscalidad e impuestos bajos para que los madrileños no paguen ni un euro más en impuestos. Apostaremos por un gasto público más eficiente, con menos duplicidades y menos barreras burocráticas para asegurar la calidad de nuestro sistema de bienestar sin meter la mano en el bolsillo a los ciudadanos. Seremos el escudo de los madrileños frente a los sablazos de Sánchez y Podemos a la clase media."
32,3.2 Exigiremos la reforma del sistema de financiación autonómica defendiendo un nuevo modelo más justo y transparente. Es fundamental que el sistema de financiación garantice un reparto equitativo de los recursos entre todas las Comunidades Autónomas que permita ofrecer unos servicios de calidad para los madrileños.
33,"3.3 Impulsaremos el establecimiento de un sistema de “recompensas tributarias” para incentivar determinados comportamientos con el fin de acabar con la economía sumergida. Ciertas acciones, como la exigencia de factura en servicios prestados en el ámbito doméstico y de pequeñas ejecuciones de obra, serán promovidas con incentivos que redundarán en un ahorro para el destinatario, para que deje de salir más a cuenta defraudar que cumplir."
34,3.4 Implementaremos incentivos fiscales para acabar con la precariedad de las empleadas del hogar. Regularemos un incentivo fiscal para los empleadores a la contratación reglada de empleados de hogar con el fin de aflorar economía sumergida en el ámbito del servicio doméstico y mitigar la precarización de este colectivo.
