id,phrases
140,7.12 Agilizaremos los trámites para el reconocimiento del Ingreso Mínimo Vital. Automatizaremos el intercambio de información con la Seguridad Social y que prevea el desarrollo de itinerarios individualizados de inclusión para los beneficiarios del Ingreso Mínimo Vital que residan en Madrid.
141,7.13 Aumentaremos los recursos destinados al sistema de dependencia para modernizar y mejorar su funcionamiento actual en la Comunidad de Madrid. Dotaremos al sistema de dependencia de la Comunidad de Madrid de los recursos económicos suficientes para reducir los días que tarda en tramitarse un expediente para el reconocimiento del grado de dependencia.
142,7.14 Eliminaremos los copagos en el servicio de teleasistencia y reduciremos los del resto de servicios para que sean más justos y equitativos. Ampliaremos el importe monetario mínimo de libre disposición de los usuarios en los criterios de valoración que se utilizan para determinar su aportación.
143,"7.15 Garantizaremos el derecho de las personas mayores a vivir en su propio entorno, a tener contacto y establecer relaciones con otras personas y a no ser internadas sin su consentimiento. También recogeremos el derecho a un alojamiento digno y adecuado para todas las personas mayores que no puedan procurarse uno por carecer de recursos suficientes."
144,7.16 Atenderemos las necesidades de las personas mayores que viven solas de manera no deseada. Diseñaremos protocolos para prevenir y detectar situaciones de soledad no deseada y evitar su cronificación. Reconoceremos a todas las personas mayores en estas circunstancias acceso al servicio de teleasistencia. Promoveremos el acompañamiento social por personas voluntarias para paliar las necesidades de contacto personal que tienen las personas mayores solas.
145,7.17 Aprobaremos una Estrategia para la igualdad social del pueblo gitano y la erradicación del antigitanismo. Desarrollaremos un marco integral de actuaciones que siente las bases para la igualdad y la inclusión del pueblo gitano y estableceremos un sistema de protección y asistencia integral a todas las personas que sean víctimas de conductas discriminatorias y violencia por causa de antigitanismo.
146,7.18 Ampliaremos la red de alojamientos de la Comunidad de Madrid para personas sin hogar y daremos apoyo sociolaboral y sanitario personalizado a las personas que se encuentren en albergues y alojamientos de emergencia habitacional.
147,7.19 Mejoraremos y agilizaremos los trámites de los que participe el Organismo Autónomo de la Agencia de Vivienda Social. Reduciremos el plazo del que dispone este organismo para la devolución del importe de la fianza por arrendamientos urbanos y facilitaremos que todos los trámites y consultas que quiera realizar la ciudadanía con este organismo puedan efectuarse a través de medios electrónicos de manera personalizada.
148,"Proteger el medio ambiente 8.1 Haremos un Plan de Prevención y Protección Climática ante temporales y fenómenos adversos. Estableceremos un repositorio digital y accesible para todos los ciudadanos, con el fin de identificar e informar de posibles vulnerabilidades ante temporales como olas de calor, tormentas y otros fenómenos extremos. 8.2 Pondremos en marcha un Plan Integral de Adaptación al Cambio Climático en la Comunidad de Madrid. Cada euro invertido en prevención supone siete euros ahorrados en reparación de costes. Los daños producidos en las cosechas, las infraestructuras públicas y privadas e incluso, dotaciones residenciales, hacen imprescindible medidas que mitiguen los efectos adversos de los temporales y fenómenos climáticos extremos. 8.3 Garantizaremos la independencia, la transparencia y la profesionalización de la gestión del Canal de Isabel II para preparar nuestra agua para el futuro. Los madrileños tenemos el agua con la mayor calidad de España, y por ello queremos también que su gestión sea la mejor de todo el país. Aseguraremos que la presidencia sea elegida por criterios objetivos, meritocráticos y profesionales, y no por adscripción partidista al gobierno de turno. 8.4 Plantaremos 1 millón de árboles de especies autóctonas e impulsaremos una política forestal integral y sostenible. Actualizaremos el Plan Forestal de la Comunidad de Madrid para los próximos años, contemplando la reforestación de zonas afectadas por la degradación ambiental y fomentando la recuperación de espacios arbolados en los municipios de la Región, apostando por una gestión sostenible de nuestros bosques. 8.5 Conectaremos el Bosque Metropolitano de Madrid con los parques regionales de la Comunidad de Madrid. El Bosque Metropolitano de Madrid es una iniciativa de Cs para un anillo forestal de 75 kilómetros que rodeará la capital. Nos aseguraremos de unirlo con parques regionales de la Comunidad de Madrid para garantizar la continuidad espacial de los nuevos espacios forestales madrileños. 8.6 Más recursos para el Cuerpo de Agentes Forestales de la Comunidad de Madrid. Dotaremos de los recursos humanos, materiales y tecnológicos necesarios al Cuerpo de Agentes Forestales de la Comunidad de Madrid, para que puedan desarrollar sus funciones con la mayor eficacia y seguridad. 8.7 Aumentaremos el nivel de reciclaje de la Comunidad de Madrid para conseguir alcanzar los objetivos de la Unión Europea. Incentivaremos y facilitaremos el reciclaje para todos los madrileños con el objetivo de reducir el riesgo para el medio ambiente y aprovechar el potencial dinamizador de la economía circular. 8.8 Reduciremos al máximo los descartes y excedentes de comida con un un Plan de Aprovechamiento de Alimentos. Implicaremos a los agentes sociales y a todos los operadores en las diferentes fases de la cadena alimentaria con la finalidad de reducir los descartes en origen y durante el proceso de transformación, distribución y comercialización, así como de minimizar el desperdicio de alimentos en comercios y establecimientos de hostelería. 8.9 Prohibiremos los plásticos de un solo uso en Madrid para frenar la contaminación, cumpliendo con los objetivos marcados por la Unión Europea. Estableceremos la prohibición de artículos de plástico desechables como pajitas, cubiertos, platos, vasos, bastoncillos, mecheros no recargables o envases de poliestireno expandido, entre otros. Promoveremos la aprobación de códigos de buenas prácticas con el sector de la distribución para reducir los envasados de plástico, sobre todo en productos frescos y perecederos."
149,"8.1 Haremos un Plan de Prevención y Protección Climática ante temporales y fenómenos adversos. Estableceremos un repositorio digital y accesible para todos los ciudadanos, con el fin de identificar e informar de posibles vulnerabilidades ante temporales como olas de calor, tormentas y otros fenómenos extremos."
150,"8.2 Pondremos en marcha un Plan Integral de Adaptación al Cambio Climático en la Comunidad de Madrid. Cada euro invertido en prevención supone siete euros ahorrados en reparación de costes. Los daños producidos en las cosechas, las infraestructuras públicas y privadas e incluso, dotaciones residenciales, hacen imprescindible medidas que mitiguen los efectos adversos de los temporales y fenómenos climáticos extremos."
151,"8.3 Garantizaremos la independencia, la transparencia y la profesionalización de la gestión del Canal de Isabel II para preparar nuestra agua para el futuro. Los madrileños tenemos el agua con la mayor calidad de España, y por ello queremos también que su gestión sea la mejor de todo el país. Aseguraremos que la presidencia sea elegida por criterios objetivos, meritocráticos y profesionales, y no por adscripción partidista al gobierno de turno."
152,"8.4 Plantaremos 1 millón de árboles de especies autóctonas e impulsaremos una política forestal integral y sostenible. Actualizaremos el Plan Forestal de la Comunidad de Madrid para los próximos años, contemplando la reforestación de zonas afectadas por la degradación ambiental y fomentando la recuperación de espacios arbolados en los municipios de la Región, apostando por una gestión sostenible de nuestros bosques."
153,8.5 Conectaremos el Bosque Metropolitano de Madrid con los parques regionales de la Comunidad de Madrid. El Bosque Metropolitano de Madrid es una iniciativa de Cs para un anillo forestal de 75 kilómetros que rodeará la capital. Nos aseguraremos de unirlo con parques regionales de la Comunidad de Madrid para garantizar la continuidad espacial de los nuevos espacios forestales madrileños.
154,"8.6 Más recursos para el Cuerpo de Agentes Forestales de la Comunidad de Madrid. Dotaremos de los recursos humanos, materiales y tecnológicos necesarios al Cuerpo de Agentes Forestales de la Comunidad de Madrid, para que puedan desarrollar sus funciones con la mayor eficacia y seguridad."
155,8.7 Aumentaremos el nivel de reciclaje de la Comunidad de Madrid para conseguir alcanzar los objetivos de la Unión Europea. Incentivaremos y facilitaremos el reciclaje para todos los madrileños con el objetivo de reducir el riesgo para el medio ambiente y aprovechar el potencial dinamizador de la economía circular.
156,"8.8 Reduciremos al máximo los descartes y excedentes de comida con un un Plan de Aprovechamiento de Alimentos. Implicaremos a los agentes sociales y a todos los operadores en las diferentes fases de la cadena alimentaria con la finalidad de reducir los descartes en origen y durante el proceso de transformación, distribución y comercialización, así como de minimizar el desperdicio de alimentos en comercios y establecimientos de hostelería."
157,"8.9 Prohibiremos los plásticos de un solo uso en Madrid para frenar la contaminación, cumpliendo con los objetivos marcados por la Unión Europea. Estableceremos la prohibición de artículos de plástico desechables como pajitas, cubiertos, platos, vasos, bastoncillos, mecheros no recargables o envases de poliestireno expandido, entre otros. Promoveremos la aprobación de códigos de buenas prácticas con el sector de la distribución para reducir los envasados de plástico, sobre todo en productos frescos y perecederos."
158,"Transporte y movilidad 8.10 Estableceremos una estrategia de transportes y movilidad para la comunidad de Madrid. Una estrategia desarrollada a través de un plan ejecutivo que coordine a las diferentes administraciones con competencias en transporte y movilidad alineada con los Objetivos de Desarrollo Sostenible 2030 poniendo a las personas en el centro, sin dejar a nadie atrás. 8.11 Invertiremos más de 7.000 millones de euros en infraestructuras de transporte público y llevaremos el Metro a Valdebebas. La línea 11 de metro será ampliada hasta Cuatro Vientos y Valdebebas, la Línea 3 se extenderá desde esta última hasta la estación de El Casar, conectando con la línea 12 de Metro y con la línea C-3 de Cercanías Renfe, la línea 5 se ampliará hasta el Aeropuerto de Barajas-Adolfo Suárez y crearemos 5 nuevos intercambiadores. 8.12 Garantizaremos el Acceso Universal y la Promoción del Transporte Público. Este Plan Universal tendrá como objetivo garantizar el acceso universal al transporte público, convirtiéndolo en la opción preferida de movilidad de la mayoría de los ciudadanos, mediante la mejora de horarios, puntualidad, rutas y capilaridad del servicio. Integraremos todos los modos de transporte a través del billete único, y mejoraremos la competitividad implementando el pago con tarjeta en todos los vehículos. 8.13 Estableceremos la Zona Única de Tarifa los fines de semana y festivos para todos los titulares de un Abono Transporte en la Comunidad de Madrid. 8.14 Abriremos el Metro 24 horas todos los fines de semana. Ampliaremos la apertura del metro durante los fines de semana hasta las 24 horas. 8.15 Abono de 30€ entre los 26 y los 30 años. Implantaremos una tarifa plana de 30 euros en el precio del Abono Transportes mensual para jóvenes de entre 26 y 30 años para todas las zonas tarifarias. Apostamos por medidas de apoyo a jóvenes y familias en un contexto de crisis como el actual y que servirá para fomentar el uso del transporte público. 8.16 Aplicaremos una Estrategia de Big Data y datos OpenSource al transporte. Los millones de datos que generamos diariamente sobre nuestra movilidad, utilizados con todas las garantías en términos de anonimato y protección de los ciudadanos, pueden conducirnos a ser la primera región gestionada con criterios de SmartCity del país, mejorando al mismo tiempo la calidad de vida de los ciudadanos. 8.17 Impulsaremos una estrategia de movilidad activa en nuestra región a través de los carriles bici, el senderismo o las rutas ciclistas. A partir de la pandemia, las formas de movilidad activa como la bici, los patinetes o caminar se han vuelto cada vez más importantes en nuestros centros urbanos y entre ellos. Por ello, desde Ciudadanos impulsaremos una estrategia que tenga en cuenta estas nuevas tendencias en el diseño de los espacios urbanos en colaboración con los municipios de la Comunidad de Madrid. 8.18 Optimizaremos el transporte de “última milla”. Ante el auge de la venta online y el reparto de paquetes a domicilio debemos apostar por el uso de los datos de transporte y Big Data de las empresas de reparto de mercancías, para optimizar el tráfico de estos vehículos y reducir la huella medioambiental de esta actividad. 8.19 Sustituiremos todos los guardarraíles asesinos existentes en las carreteras de la Comunidad de Madrid. Nos comprometemos a sustituirlos por nuevos modelos con Sistemas de Protección para Motociclistas de esta forma, mejoraremos la seguridad de los motoristas y reduciremos las lesiones asociadas."
159,"8.10 Estableceremos una estrategia de transportes y movilidad para la comunidad de Madrid. Una estrategia desarrollada a través de un plan ejecutivo que coordine a las diferentes administraciones con competencias en transporte y movilidad alineada con los Objetivos de Desarrollo Sostenible 2030 poniendo a las personas en el centro, sin dejar a nadie atrás."
160,"8.11 Invertiremos más de 7.000 millones de euros en infraestructuras de transporte público y llevaremos el Metro a Valdebebas. La línea 11 de metro será ampliada hasta Cuatro Vientos y Valdebebas, la Línea 3 se extenderá desde esta última hasta la estación de El Casar, conectando con la línea 12 de Metro y con la línea C-3 de Cercanías Renfe, la línea 5 se ampliará hasta el Aeropuerto de Barajas-Adolfo Suárez y crearemos 5 nuevos intercambiadores."
161,"8.12 Garantizaremos el Acceso Universal y la Promoción del Transporte Público. Este Plan Universal tendrá como objetivo garantizar el acceso universal al transporte público, convirtiéndolo en la opción preferida de movilidad de la mayoría de los ciudadanos, mediante la mejora de horarios, puntualidad, rutas y capilaridad del servicio. Integraremos todos los modos de transporte a través del billete único, y mejoraremos la competitividad implementando el pago con tarjeta en todos los vehículos."
162,8.13 Estableceremos la Zona Única de Tarifa los fines de semana y festivos para todos los titulares de un Abono Transporte en la Comunidad de Madrid.
163,8.14 Abriremos el Metro 24 horas todos los fines de semana. Ampliaremos la apertura del metro durante los fines de semana hasta las 24 horas.
164,8.15 Abono de 30€ entre los 26 y los 30 años. Implantaremos una tarifa plana de 30 euros en el precio del Abono Transportes mensual para jóvenes de entre 26 y 30 años para todas las zonas tarifarias. Apostamos por medidas de apoyo a jóvenes y familias en un contexto de crisis como el actual y que servirá para fomentar el uso del transporte público.
165,"8.16 Aplicaremos una Estrategia de Big Data y datos OpenSource al transporte. Los millones de datos que generamos diariamente sobre nuestra movilidad, utilizados con todas las garantías en términos de anonimato y protección de los ciudadanos, pueden conducirnos a ser la primera región gestionada con criterios de SmartCity del país, mejorando al mismo tiempo la calidad de vida de los ciudadanos."
166,"8.17 Impulsaremos una estrategia de movilidad activa en nuestra región a través de los carriles bici, el senderismo o las rutas ciclistas. A partir de la pandemia, las formas de movilidad activa como la bici, los patinetes o caminar se han vuelto cada vez más importantes en nuestros centros urbanos y entre ellos. Por ello, desde Ciudadanos impulsaremos una estrategia que tenga en cuenta estas nuevas tendencias en el diseño de los espacios urbanos en colaboración con los municipios de la Comunidad de Madrid."
167,"8.18 Optimizaremos el transporte de “última milla”. Ante el auge de la venta online y el reparto de paquetes a domicilio debemos apostar por el uso de los datos de transporte y Big Data de las empresas de reparto de mercancías, para optimizar el tráfico de estos vehículos y reducir la huella medioambiental de esta actividad."
168,"8.19 Sustituiremos todos los guardarraíles asesinos existentes en las carreteras de la Comunidad de Madrid. Nos comprometemos a sustituirlos por nuevos modelos con Sistemas de Protección para Motociclistas de esta forma, mejoraremos la seguridad de los motoristas y reduciremos las lesiones asociadas."
169,"Electrificación y eficiencia energética 8.20 Impulsaremos una red de recarga para vehículos eléctricos en toda la Comunidad de Madrid. Serán puntos de acceso público y estarán distribuidos por toda la región. Los puntos serán de carga semi-rápida, rápida y ultra-rápida, y llevarán asociada una aplicación con la ubicación de estos puntos y diversa información de interés sobre los mismos. 8.21 Culminaremos la renovación de las flotas oficiales por vehículos eléctricos y/o poco contaminantes. Nos aseguraremos de instalar e incorporar puntos de recarga de acceso público en instalaciones dependientes de la Comunidad de Madrid para impulsar la extensión de este tipo de servicios. 8.22 Seguiremos desarrollando el programa regional de Eficiencia Energética en Edificaciones Residenciales y Dotaciones. Complementaremos la inversión de las Comunidades de Vecinos y los Ayuntamientos que emprendan mejoras en sus edificaciones siempre que supongan un importante ahorro del consumo energético y reducción de las emisiones, acciones que fomenten la autosuficiencia o incluso el aprovechamiento del espacio dotacional para aumentar la superficie instalada generadora de energía renovable. 8.23 Garantizaremos que todos los edificios públicos sean cero emisiones. Impulsaremos las actuaciones necesarias para incrementar el consumo de energías renovables, minimizar la demanda de energía a través de la mejora de la eficiencia energética de las edificaciones, la producción propia de energías renovables y las políticas de ahorro energético. 8.24 Impulsaremos la Ley de Sostenibilidad Energética para expandir las energías renovables, eliminando en todo lo posible las barreras administrativas existentes, especialmente para las instalaciones autoconsumo para particulares. Se creará una ventanilla única de asesoramiento e información para las instalaciones de autoconsumo de particulares individual y colectivo, PYMES, e instalaciones agrarias. 8.25 Potenciaremos la energía fotovoltaica, aprovechando la infraestructura existente en edificios públicos. Los beneficios obtenidos por la venta de energía excedente se dedicarán a la financiación de un fondo específico de lucha contra la pobreza energética. 8.26 Apoyaremos la instalación de placas solares, a través de la bonificación temporal en el IBI a favor de los propietarios de viviendas que instalen este sistema de energía renovable y pediremos al Gobierno que incluya este tipo de inversiones en su plan de subvenciones para la rehabilitación y eficiencia energética de vivienda."
170,"8.20 Impulsaremos una red de recarga para vehículos eléctricos en toda la Comunidad de Madrid. Serán puntos de acceso público y estarán distribuidos por toda la región. Los puntos serán de carga semi-rápida, rápida y ultra-rápida, y llevarán asociada una aplicación con la ubicación de estos puntos y diversa información de interés sobre los mismos."
171,8.21 Culminaremos la renovación de las flotas oficiales por vehículos eléctricos y/o poco contaminantes. Nos aseguraremos de instalar e incorporar puntos de recarga de acceso público en instalaciones dependientes de la Comunidad de Madrid para impulsar la extensión de este tipo de servicios.
172,"8.22 Seguiremos desarrollando el programa regional de Eficiencia Energética en Edificaciones Residenciales y Dotaciones. Complementaremos la inversión de las Comunidades de Vecinos y los Ayuntamientos que emprendan mejoras en sus edificaciones siempre que supongan un importante ahorro del consumo energético y reducción de las emisiones, acciones que fomenten la autosuficiencia o incluso el aprovechamiento del espacio dotacional para aumentar la superficie instalada generadora de energía renovable."
173,"8.23 Garantizaremos que todos los edificios públicos sean cero emisiones. Impulsaremos las actuaciones necesarias para incrementar el consumo de energías renovables, minimizar la demanda de energía a través de la mejora de la eficiencia energética de las edificaciones, la producción propia de energías renovables y las políticas de ahorro energético."
174,"8.24 Impulsaremos la Ley de Sostenibilidad Energética para expandir las energías renovables, eliminando en todo lo posible las barreras administrativas existentes, especialmente para las instalaciones autoconsumo para particulares. Se creará una ventanilla única de asesoramiento e información para las instalaciones de autoconsumo de particulares individual y colectivo, PYMES, e instalaciones agrarias."
175,"8.25 Potenciaremos la energía fotovoltaica, aprovechando la infraestructura existente en edificios públicos. Los beneficios obtenidos por la venta de energía excedente se dedicarán a la financiación de un fondo específico de lucha contra la pobreza energética."
176,"8.26 Apoyaremos la instalación de placas solares, a través de la bonificación temporal en el IBI a favor de los propietarios de viviendas que instalen este sistema de energía renovable y pediremos al Gobierno que incluya este tipo de inversiones en su plan de subvenciones para la rehabilitación y eficiencia energética de vivienda."
177,"Bienestar animal y mascotas 8.27 Avanzaremos en nuestro compromiso con la prohibición del sacrificio de animales sanos, las mutilaciones con fines estéticos, la exposición de animales en escaparates y su entrega en premios. 8.28 Promoveremos que las protectoras de animales sean consideradas entidades de utilidad pública y garantizaremos el acceso de los animales a los albergues de personas sin hogar, a las residencias de mayores y a las casas de acogida y pisos tutelados de las víctimas de violencia de género. 8.29 Dispondremos que los instrumentos de planeamiento urbanístico deban prever la dotación de espacios de esparcimiento para animales de compañía. La dotación de zonas verdes y equipamientos públicos en los planes de ordenación urbana deberán contemplar la instalación de espacios para el recreo y ejercicio de los animales. 8.30 Estableceremos un sistema de adopción animal unificado que facilite y promueva la adopción de animales de compañía, priorizando el acogimiento familiar. Crearemos una red de centros de acogida e incrementaremos los recursos para garantizar una atención adecuada a los animales de compañía en situación de desamparo, trabajando conjuntamente con las entidades sociales protectoras y con refugios de animales para mejorar la detección y respuesta."
178,"8.27 Avanzaremos en nuestro compromiso con la prohibición del sacrificio de animales sanos, las mutilaciones con fines estéticos, la exposición de animales en escaparates y su entrega en premios."
179,"8.28 Promoveremos que las protectoras de animales sean consideradas entidades de utilidad pública y garantizaremos el acceso de los animales a los albergues de personas sin hogar, a las residencias de mayores y a las casas de acogida y pisos tutelados de las víctimas de violencia de género."
180,8.29 Dispondremos que los instrumentos de planeamiento urbanístico deban prever la dotación de espacios de esparcimiento para animales de compañía. La dotación de zonas verdes y equipamientos públicos en los planes de ordenación urbana deberán contemplar la instalación de espacios para el recreo y ejercicio de los animales.
181,"8.30 Estableceremos un sistema de adopción animal unificado que facilite y promueva la adopción de animales de compañía, priorizando el acogimiento familiar. Crearemos una red de centros de acogida e incrementaremos los recursos para garantizar una atención adecuada a los animales de compañía en situación de desamparo, trabajando conjuntamente con las entidades sociales protectoras y con refugios de animales para mejorar la detección y respuesta."
