,id,p0_c1,party_id,candidate_id,phrase,date
695,696,1,5,5,"Estaba previsto que Pablo Iglesias participará de manera telemática en esta cumbre, pero ayer no aparecía su nombre en la agenda, veremos que dice Sánchez a esta crisis importante, recuerda en Moncloa que tiene la última palabra de cómo queda el Consejo de Ministros.",2021-03-15
696,697,1,5,5,"Como decíamos, poco más de un año y dos meses va a estar Pablo Iglesias en el Gobierno de coalición, el primero de la democracia.",2021-03-15
697,698,1,5,5,Que Pablo Iglesias entrase en el Gobierno no fue tarea fácil.,2021-03-15
698,699,1,5,5,Pablo Iglesias se enfrentará a Isabel Díaz Ayuso.,2021-03-15
699,700,1,5,5,"-La reacción más esperada era la de Ayuso, se muestra convencida de que su candidatura va a aglutinar a todos los que no quieren a Pablo Iglesias al frente de Madrid, y tira de sorna, dice que España le debe una por sacarle de Moncloa.",2021-03-15
700,701,1,5,5,"La candidatura de Pablo Iglesias y su salida del gobierno obliga a mover ficha, Ángel Gabilondo guarda silencio, y desde Más Madrid adelantan que se sentarán a hablar.",2021-03-15
701,702,1,5,5,"España me debe una, que hemos sacado a Pablo Iglesias de la Moncloa.",2021-03-15
702,703,1,5,5,"Está todo desde los míticos pañales de bebé, a los vestidos de billar a la camisa que llevaron en el 1,2,3 con la canción de Julio Iglesias.",2021-05-03
703,704,1,5,5,"Y en el día de la Madre, también Iglesias califica el acto de la Comunidad de electoralista.",2021-05-02
704,705,1,5,5,"Nosotros somos el partido que encarna los valores del raciocinio, no vamos a permitir que gobierne Iglesias con Gabilondo y Gabilondo con Iglesias y que cunda ese enfrentamiento.",2021-05-01
705,706,1,5,5,"Iglesias reconoce que pertenece al partido, pero niega que sea su escolta y cuestiona que la noticia se haya conocido hoy.",2021-05-01
706,707,1,5,5,"Iglesias reconoce que pertenece al partido, niega que sea su escolta y cuestiona que la noticia se haya conocido hoy.",2021-05-01
707,708,1,5,5,"Muy crítico, VOX, en el primer 1 de mayo de su sindicato, culpa a Iglesias y a Sánchez.",2021-05-01
708,709,1,5,5,"Iglesias también va a huir, porque creo que hay pleno todos los jueves.",2021-05-01
709,710,1,5,5,"Lo condenamos y esperamos que Iglesias, no pise no sólo el gobierno, que no decida lo más importante para los ciudadanos.",2021-05-01
710,711,1,5,5,-Frente a la agenda del enfrentamiento de Gabilondo y de Iglesias.,2021-04-30
711,712,1,5,5,Vox arremete contra Iglesias.,2021-04-30
712,713,1,5,5,"-Tratan temas desde la arquitectura, y la concepción espacial como Ángela de la Cruz o Cristina Iglesias o Vera Luter, hasta todos los temas que tienen que ver con el cuerpo femenino, que eso si se repite en personas como Ana Laura Alaez, que es una artista de Bilabo.",2021-04-30
713,714,1,5,5,"-Un intento a la desesperada de frenar la caída histórica del PSOE en Madrid, que lo va a ser, va a ser contundente y que incluso podría ser sorpasado' VOX responsabiliza a Iglesias de esta acción de FEMEN en su sede y asegura que serán determinantes para frenarlos.",2021-04-30
714,715,1,5,5,Sobre la crispación en campaña Ayuso señala a Iglesias.,2021-04-29
715,716,1,5,5,'Yo prefiero que la gente se tome una cerveza en una terraza a que haya descontrol en la casas' Y ha cargado contra Iglesias.,2021-04-29
716,717,1,5,5,'Madre mía qué campañita nos está dando Iglesias.,2021-04-29
717,718,1,5,5,Iglesias responde vía Twitter.,2021-04-29
718,719,1,5,5,VOX mira a Iglesias y anuncia que se personará en todas las causas que investiguen las amenazas.,2021-04-28
719,720,1,5,5,Iglesias advierte: -Las amenazas de los fascistas no son contra nosotros.,2021-04-28
720,721,1,5,5,"Iglesias pide -Y frente al fascismo, claro que sí, más democracia.",2021-04-27
721,722,1,5,5,-Ayuso acusa a Iglesias de disfrutar con el clima de tensión.,2021-04-27
722,723,1,5,5,E Iglesias.,2021-04-27
723,724,1,5,5,"Según ha podido saber TVE las cartas con amenazas y balas a Marlaska, Iglesias y a la directora de la GC están limpias, no hay huellas ni ningún resto de material genético, por lo que se siguen analizando las cámaras de seguridad.",2021-04-27
724,725,1,5,5,"No creen que el identificado fuera quien envió las amenazas y balas a Marlaska, Iglesias y a la directora de la GC.",2021-04-26
725,726,1,5,5,Mismo mensaje de Iglesias a los suyos.,2021-04-26
726,727,1,5,5,"Iglesias habla de amenazas fascistas y, Vox dice que ellos denuncian cualquier amenaza y, pide al resto de partidos que hagan lo mismo.",2021-04-26
727,728,1,5,5,"Se envió antes de que se supiera que Marlaska, Iglesias y la directora de la Guardia Civil habían recibido otras cartas con amenazas y balas.",2021-04-26
728,729,1,5,5,"Mientras tanto, las fuerzas de seguridad siguen investigando quién envió las cartas con balas a Marlaska, Iglesias y Gámez.",2021-04-26
729,730,1,5,5,Vox vuelve a cargar contra Iglesias.,2021-04-25
730,731,1,5,5,"Se ha acercado a visitar las carpas del partido pese a la lluvia y ha criticado que Gabilondo se haya arrojado, dice, en brazos de Iglesias y que el candidato de Unidas Podemos se haya apropiado del termino demócrata.",2021-04-25
731,732,1,5,5,"Y arropando a la candidata, Abascal, que se ha referido a las amenazas de muerte denunciadas ayer por VOX en un stand como este y ha vuelto a cargar contra Iglesias.",2021-04-25
732,733,1,5,5,"El Betis también la tuvo con esta contra que inicia Laínez y que termina con un mano a mano de Borja Iglesias que el belga consigue despejar Si no se puede ganar, no lo pierdas.",2021-04-25
733,734,1,5,5,"El señor Iglesias, en realidad, no es más que el puñetero niño consentido de la política española.",2021-04-24
734,735,1,5,5,Iglesias pide no caer en sus provocaciones.,2021-04-24
735,736,1,5,5,"En San Sebastián de los Reyes, como la única alternativa a la izquierda y como los únicos que van a confortar sus ideas, e insiste, las amenazas a Iglesias son una farsas que hay que investigar.",2021-04-24
736,737,1,5,5,"Iglesias recuerda, como hace ya de dos años dijo: 'Alerta antifacista' y después de lo de ayer pide, de llenar más que nuca las urnas y asegura, 'la democracia esta en peligro'.",2021-04-24
737,738,1,5,5,"Y también queremos recordar a otro compañero muy querido fallecido ayer, Diego Iglesias.",2021-04-24
738,739,1,5,5,Iglesias ha exigido a Monasterio una rectificación.,2021-04-23
739,740,1,5,5,"VOX se reafirma y manda este mensaje a Iglesias 'Cierre la puerta al salir' Rocío Monasterio Candidata de VOX 'Esto apesta a montaje y por eso nos personaremos como acusación popular' Iglesias pide responderles: Con buenas formas, con la dignidad de la gente trabajadora, yendo a votar pasivamente.",2021-04-23
740,741,1,5,5,"Antes, el PP de la Comunidad de Madrid colgaba este tuit donde le decía a Iglesias: cierre al salir.",2021-04-23
741,742,1,5,5,"La policía investiga ya la autoría de esas cartas con amenazas de muerte que, en el caso de Iglesias, van también dirigidas contra su mujer y sus padres.",2021-04-23
742,743,1,5,5,"Antes de acabar, queremos recordar a un compañero, al reportero Diego Iglesias, que desgraciadamente ha fallecido hoy.",2021-04-23
743,744,1,5,5,"Cuatro a Iglesias, dos a Marlaska y una a la directora de la Guardia Civil.",2021-04-23
744,745,1,5,5,"Tu mujer, tus padres y tú estáis sentenciados a la pena capital, dice en la de Iglesias.",2021-04-23
745,746,1,5,5,Iglesias ha pedido una rectificación que no se ha producido y ha abandonado el debate.,2021-04-23
746,747,1,5,5,- minutos después Iglesias respondía aquí en la hora de la uno.,2021-04-23
747,748,1,5,5,Iglesias ha ido poner una denuncia contra las amenazas.,2021-04-23
748,749,1,5,5,"- el señor Iglesias salido huyendo, nosotros condenamos toda la violencia, el fascismo y el comunismo.",2021-04-23
749,750,1,5,5,- en Twitter dice ' hemos conseguido Chara Iglesias'.,2021-04-23
750,751,1,5,5,"No van a sumar por muchos esfuerzos que haga Tezanos por salvar al soldado Gabilondo la buena noticia es que no va a gobernar Gabilondo con Iglesias, diga el CIS lo que diga.",2021-04-22
751,752,1,5,5,"Más quisieran Tezanos, Sánchez y Gabilondo que hubiera empate técnico A Gabilondo le ha recriminado Ayuso su acercamiento a Iglesias.",2021-04-22
752,753,1,5,5,Caretas fuera Gabilondo e Iglesias van de la mano.,2021-04-22
753,754,1,5,5,"La gestión de la pandemia y los fallecidos, marcaron parte de los rifi-rafes más bronco, entre Iglesias y Díaz Ayuso.",2021-04-22
754,755,1,5,5,Caretas fuera; Gabilondo e Iglesias van de la mano.,2021-04-22
755,756,1,5,5,"PSOE y Unidas Podemos confirman que retirarán la reforma en los próximos días, aunque los de Iglesias insisten en que hace falta una alternativa.",2021-04-20
756,757,1,5,5,"Vox mejoraría y seguiría en tercera posición y Unidas Podemos sube un punto, en la primera encuesta tras la salida de Iglesias del Gobierno.",2021-04-19
757,758,1,5,5,Y sobre Iglesias...,2021-04-19
758,759,1,5,5,"Ciudadanos, que sigue paseando su bus naranja por Madrid, no quiere un pacto entre Gabilondo e Iglesias.",2021-04-19
759,760,1,5,5,Iglesias lo ha dicho en una metalúrgica.,2021-04-19
760,761,1,5,5,Iglesias y los centros comerciales han vuelto a la actividad.,2021-04-19
761,762,1,5,5,Vox mejoraría y seguiría en tercera posición y Unidas Podemos sube un punto en la primera encuesta tras la salida de Iglesias del Gobierno.,2021-04-19
762,763,1,5,5,Alerta de que gobiernen los extremos y de un pacto de Gabilondo con Iglesias.,2021-04-19
763,764,1,5,5,Iglesias acusa a Ayuso de usar a los madrileños Los datos de la pandemia indican una ligera mejoría en los contagios en Cataluña con respecto a hace una semana.,2021-04-18
764,765,1,5,5,"No tiremos por la borda lo que hemos conseguido, con Madrid no se juega, con Madrid no se hace experimentos, para darle la economía a Iglesias o bien la educación, o las políticas sociales a Monasterio.",2021-04-18
765,766,1,5,5,"Arropado por la ministra, Ione Belarra y la vicepresidenta, Yolanda Díaz, Iglesias pide el voto para frenar a los que no defienden los derechos sociales, a las políticas de odio, dice, de la derecha y la ultraderecha.",2021-04-18
766,767,1,5,5,"'Si se puede', Iglesias ha dejado el Gobierno porque quiere ser el impulso que movilice, a al izquierda en Madrid.",2021-04-17
767,768,1,5,5,"No va a haber un gobierno de Ayuso con VOX, no va a haber un gobierno de Gabilondo con Iglesias.",2021-04-17
768,769,1,5,5,VOX espera ser determinante para frenar a Iglesias.,2021-04-17
769,770,1,5,5,Iglesias lo fía todo a sus resultados en Madrid e intentará ser un revulsivo para la izquierda.,2021-04-17
770,771,1,5,5,Ciudadanos cree que Gabilondo esconde en realidad sus cartas 'Que está ¿preparando ya la vicepresidencia política para el Sr Iglesias?,2021-04-16
771,772,1,5,5,'¿Que está preparando ya la vicepresidencia política para el señor Iglesias?,2021-04-16
772,773,1,5,5,"También otros actos con presencia de líderes nacionales: Gabilondo arropado por Carmen Calvo, Abascal con Monasterio, e Iglesias con Yolanda Díaz.",2021-04-10
773,774,1,5,5,Y así estaban las hermandades e iglesias de Sevilla.,2021-04-04
774,775,1,5,5,"Precisamente en un acto sobre vivienda, Iglesias ha llamado a la participación en los barrios de clase trabajadora.",2021-04-04
775,776,1,5,5,"Sin pasos en las calles, la atención se ha centrado en las iglesias donde durante toda la semana ha habido colas, también este Domingo de Resurrección para visitar la imágenes de las diferentes hermandades.",2021-04-04
776,777,1,5,5,"Borja Iglesias, de penalti, sumó su noveno tanto esta temporada, pero 20 minutos después.",2021-04-04
777,778,1,5,5,"En un acto sobre Vivienda en el que también ha estado Colau, Iglesias ha llamado a la participación en los barrios de clase trabajadora.",2021-04-04
778,779,1,5,5,"Esta mañana, de nuevo, se han visto colas en algunas iglesias para visitar las imágenes, Alejandra Muñoz.",2021-04-04
779,780,1,5,5,"Las iglesias han estado abiertas durante toda la semana, para que los fieles pudieran ver las imágenes, que habitualmente salen en procesión por las calles de Sevilla.",2021-04-04
780,781,1,5,5,"En un año sin procesiones, las saetas se trasladan al interior de las iglesias.",2021-04-03
781,782,1,5,5,"Sábado Santo en Andalucía en el que hemos vuelto a ver colas a la entrada de muchas iglesias, como ésta de Sevilla.",2021-04-03
782,783,1,5,5,Hemos visto gente visitando las iglesias hoy sin duda la estrella es la imagen del Cristo yacente.,2021-04-03
783,784,1,5,5,"Por aquí deberían pasar 7 hermandades, algunas tan señaladas como la del Cristo de la inspiración los fieles han podido venerar las imágenes en sus templos, por eso se han registrado colas a las puertas de muchas iglesias, para ver de cerca estas imágenes.",2021-04-02
784,785,1,5,5,"Colas, turnos y distancias Miles de personas esperando fuera y dentro de las iglesias para ver las imágenes, colas, turnos y distancias.",2021-04-02
785,786,1,5,5,"Pero pide a la ciudadanía, que no sea golpe alrededor de las iglesias.",2021-04-01
786,787,1,5,5,"El efecto de la vacunación masiva está permitiendo la celebración de esta Semana Santa aquí, en Jerusalén, con iglesias como esta del Santo Sepulcro abiertas.",2021-04-01
787,788,1,5,5,"Iglesias ha destacado su papel en el Gobierno, como ejemplo de gestión para la mayoría social.",2021-04-01
788,789,1,5,5,El presidente Sánchez ha vuelto a agradecer el trabajo de Iglesias en el Gobierno.,2021-03-30
789,790,1,5,5,Iglesias ha defendido su gestión estos meses y ha lanzado también este mensaje: Marca de la casa.,2021-03-30
790,791,1,5,5,Iglesias ocupaba la segunda.,2021-03-30
791,792,1,5,5,"Díaz es comunista de carné, actualmente no milita en Podemos, e Iglesias la ha propuesto como sucesora y candidata en las próximas elecciones generales.",2021-03-30
792,793,1,5,5,"En ese tiempo se han visto varios momentos de tensión dentro del gobierno de coalición, pero hoy, el presidente Sánchez ha vuelto a defender el trabajo de Iglesias en público.",2021-03-30
793,794,1,5,5,-Así se despide Sánchez de Iglesias.,2021-03-30
794,795,1,5,5,Es la última imagen juntos y este el último video de Iglesias desde su despacho.,2021-03-30
795,796,1,5,5,El público puede visitarlas en algunas iglesias.,2021-03-30
796,797,1,5,5,"Al menos esta Semana Santa, a diferencia de la pasada, con el confinamiento, los altares y las veneraciones que las hermandades organizan estos días en iglesias y parroquias dan un leve respiro a algunas empresas del sector.",2021-03-30
797,798,1,5,5,"Mucha afluencia, por ejemplo, en las iglesias del centro de Sevilla o en las playas del norte del país y también en Canarias.",2021-03-28
798,799,1,5,5,"Las imágenes, sí se pueden ver en algunas iglesias, aunque, Alejandra Muñoz, extremando la seguridad.",2021-03-28
799,800,1,5,5,Hemos visto colas en otras iglesias de la ciudad.,2021-03-28
800,801,1,5,5,"Mi idea es hacer una ruta viendo las hermandades, me cogí los días de vacaciones, para poder visitar las iglesias, ver las imágenes, rezarles y tener mi momento de bohemia y de disfrute a solas.",2021-03-28
801,802,1,5,5,"No nombra a Iglesias, pero lanza esta advertencia.",2021-03-27
802,803,1,5,5,"Iglesias apuesta porque en Madrid haya tambien Gobierno de coalición ante los suyos saca pecho de lo logros dice, gracias a su presencia en Moncloa y en modo electoral, lanza sus ataques al PP.",2021-03-27
803,804,1,5,5,"Por eso, la policía incluso podría clausurar iglesias si fuera necesario.",2021-03-26
804,805,1,5,5,"No habrá procesiones, pero las Hermandades y las cofradías han organizado visitas a las iglesias que estarán abiertas estos días.",2021-03-26
805,806,1,5,5,"-De manera íntima, recogimiento, visitando las iglesias.",2021-03-26
806,807,1,5,5,Y la policía podría cerrar iglesias si se producen aglomeraciones.,2021-03-26
807,808,1,5,5,"El laboratorio de pruebas del sr. Sánchez, del sr. Iglesias y de la sra. Arrimadas, de Podemos, PSOE y Ciudadanos no es una buena noticia.",2021-03-25
808,809,1,5,5,Iglesias ha anunciado que dejará el escaño antes que la vicepresidencia antes del martes.,2021-03-24
809,810,1,5,5,Iglesias asistía a su último pleno.,2021-03-24
810,811,1,5,5,"Iglesias se marcha con las espadas en alto: advierte que denunciará al secretario general del PP por un presunto delito de cohecho, dicen en Podemos, por comprar tránsfugas de Vox y de Ciudadanos.",2021-03-24
811,812,1,5,5,"Y en la tribuna, el adiós de Iglesias es un homenaje a los que lucharon contra el fascismo.",2021-03-24
812,813,1,5,5,"Iglesias cierra una etapa, un ciclo político.",2021-03-24
813,814,1,5,5,Iglesias dejará su escaño en los próximos días.,2021-03-24
814,815,1,5,5,"Iglesias cierra un ciclo político, cierra una etapa, deja el congreso, donde llegó hace 5 años, y se marcha con las espadas en alto . anunciado que presentará una denuncia contra secretario general del PP por comprar diputados.",2021-03-24
815,816,1,5,5,"Ya desde su llegada al hemiciclo, todo indicaba que hoy no era un pleno más para Iglesias.",2021-03-24
816,817,1,5,5,"Despedida a la que Iglesias responde con una denuncia contra García Egea, por un presunto delito de cohecho por comprar, dicen en Podemos, tránsfugas de C's y de Vox.",2021-03-24
817,818,1,5,5,"Y como era día de despedidas, no ha faltado la de Iglesias desde la tribuna.",2021-03-24
818,819,1,5,5,"Se publica su último disco, un trabajo inspirado en una peregrinación de la soprano a iglesias de Armenia y Artsaj.",2021-03-24
819,820,1,5,5,"La ley electoral obliga a Iglesias, cabeza de lista por Unidas Podemos, a dejar la vicepresidencia segunda antes del 31 de marzo, fecha tope para la presentación de candidaturas.",2021-03-23
820,821,1,5,5,"-Si el número uno manda poco en el PSOE, imagino que el dos muchomenos El PP no da credibilidad al veto de Gabilondo a Iglesias.",2021-03-23
821,822,1,5,5,"Isa Serra estará en la lista de Iglesias igual que el exjemad, Julio Rodríguez. y la activista de la Plataforma de afectados por la hipoteca, Alejandra Jacinto.",2021-03-23
822,823,1,5,5,Insiste: pactar con Iglesias no entra en sus planes.,2021-03-23
823,824,1,5,5,"Isabel Díaz Ayuso no se lo cree, piensa que acabará pactando con Iglesias.",2021-03-23
824,825,1,5,5,"Serra formará parte de la candidatura de Iglesias, también su jefe de gabinete el exjemad Julio Rodríguez.",2021-03-23
825,826,1,5,5,"Prefiero con este Iglesias, no.",2021-03-22
826,827,1,5,5,Cuando dijo seis días antes de votar yo no podría pactar con Iglesias porque no podría dormir.,2021-03-22
827,828,1,5,5,Surge del interés del Sr Sánchez de expulsar a Iglesias y de destrozar a Ciudadanos con el abrazo del oso.,2021-03-22
828,829,1,5,5,"Y en el PP dicen que miente, igual que Sánchez, aseguran, cuando dijo que no pactaría con Iglesias porque no dormiría tranquilo.",2021-03-22
829,830,1,5,5,"Si el viernes Iglesias decía que Ayuso acabaría en prisión, hoy la aludida le responde que eso es lo que le gustaría a él, ver a sus adversarios en la cárcel.",2021-03-22
830,831,1,5,5,El Partido Popular cree que Iglesias debería dejar el acta de diputado.,2021-03-21
831,832,1,5,5,En Sevilla muchos se han acercado a las iglesias para ver las imágenes días antes de que llegue la Semana Santa.,2021-03-21
832,833,1,5,5,Iglesias entra en campaña advirtiendo a los socialistas de que la ley de vivienda es un compromiso firmado.,2021-03-21
833,834,1,5,5,Ante su no a ir en coalición con Iglesias...,2021-03-21
834,835,1,5,5,El Partido Popular cree que Iglesias debería dejar el acta de diputado.,2021-03-21
835,836,1,5,5,En Sevilla muchos se han acercado a las iglesias para ver las imágenes días antes de que llegue la Semana Santa.,2021-03-21
836,837,1,5,5,A Iglesias y a Ciudadanos se dirige el PP.,2021-03-21
837,838,1,5,5,"Lo que a Sánchez e Iglesias les molesta es que hoy una mujer, una mujer del PP, sea hoy el ejemplo de buena gestión y liderazgo.",2021-03-20
838,839,1,5,5,"Se refiere al pacto de coalición de 2019, en el que, recuerda Iglesias, se contempla, textualmente, poner techo a las subidas abusivas del alquiler.",2021-03-20
839,840,1,5,5,"Lo que a Sánchez e Iglesias les molesta es que hoy una mujer, una mujer del PP, sea hoy el ejemplo de buena gestión y liderazgo.",2021-03-20
840,841,1,5,5,"Aunque, aseguran, tendrán que entenderse con los de Iglesias.",2021-03-20
841,842,1,5,5,"Se refiere al pacto de coalición de 2019, en el que, recuerda Iglesias, se contempla, textualmente, poner techo a las subidas abusivas del alquiler.",2021-03-20
842,843,1,5,5,"Iglesias mete presión al PSOE, su intención es sacar adelante la Ley de Vivienda antes de marcharse del Gobierno.",2021-03-19
843,844,1,5,5,"Y en su nuevo disco, Sting ha elegido no cantar solo: En el álbum que se publica hoy, el artista británico recupera las colaboraciones más queridas a lo largo de su carrera, como los temas que comparte con Erick Clapton, Julio Iglesias o Zucchero El Real Madrid se enfrentará al Liverpool en los cuartos de final de la Champions League.",2021-03-19
844,845,1,5,5,"Si ayer la presidenta madrileña decía que el vicepresidente estaba acabado, hoy Iglesias contesta que ella acabará investigada y en la cárcel.",2021-03-19
845,846,1,5,5,"En una entrevista en Televisión Española, Iglesias además se ha referido a la brecha abierta entre los socios de coalición por la futura ley de vivienda.",2021-03-19
846,847,1,5,5,Iglesias entra en campaña sin olvidar su papel dentro del Gobierno .,2021-03-19
847,848,1,5,5,"Durante el encierro se dedicó a revisar sus archivosmusicales y claro revisar los archivos musicalesde Sting es mucha tarea Y ahí se encontró con decenas de colaboraciones que quiso reunir desde canción con Eric Clapton a Annie Lennox o Julio Iglesias Un trabajo en el que incluye nuevas colaboraciones como esta con Zuchhero No descarta volver a recurrir a compañeros a los que admira para unir estilos y talento A ver quién le dice que no y de regalo esta revisión de unos de sus clásicos por los que no pasa el tiempo 'Tu Veneno' es el nuevo sencillo de J. Balvin, adelanto de su nuevo álbum.",2021-03-19
848,849,1,5,5,Mientras la relación entre Iglesias y Errejón sigue dando que hablar.,2021-03-18
849,850,1,5,5,El líder de Más Madrid desvela que no tiene comunicación con Iglesias.,2021-03-18
850,851,1,5,5,"Menos sutil ha sido Ayuso, habla de Iglesias en estos términos.",2021-03-18
851,852,1,5,5,"En Podemos empiezan hoy sus primarias, se da por descontado que las ganará Iglesias, aunque queda por ver quién le acompañará en las listas.",2021-03-18
852,853,1,5,5,El vicepresidente Iglesias advierte que no va a consentir que incumplan el acuerdo.,2021-03-18
853,854,1,5,5,"De esa moción se ha hablado también en el Congreso de los Diputados, donde Sánchez e Iglesias han acusado al PP de transfuguismo.",2021-03-17
854,855,1,5,5,"- Señor Iglesias, que poco nos ha durado.",2021-03-17
855,856,1,5,5,"Iglesias se ha defendido atacando, especialmente a Teodoro García Egea.",2021-03-17
856,857,1,5,5,"La moción de censura en Murcia, las elecciones en Madrid y la salida de Iglesias para ser candidato, han centrado los rifirrafes.",2021-03-17
857,858,1,5,5,La marcha de Iglesias ha protagonizado hoy gran parte del debate.,2021-03-17
858,859,1,5,5,"'Señor Iglesias, qué poco nos ha durado, y el 5 de mayo a usted solo le va a quedar sentarse a rodear la Asamblea de Madrid'.",2021-03-17
859,860,1,5,5,"Yolanda Díaz, a quien Iglesias señaló ayer como su relevo en la vicepresidencia segunda, será finalmente vicepresidenta tercera y mantendrá la cartera Trabajo.",2021-03-16
860,861,1,5,5,"Aunque Iglesias la propuso para que ocupara su puesto Yolanda Díaz acepta la vicepresidencia tercera, y mantiene la cartera de Trabajo.",2021-03-16
861,862,1,5,5,"Según fuentes de Moncloa, en el Gobierno algunos han respirado con la marcha del vicepresidente, pero preocupa también que Iglesias sea más duro con el Gobierno desde fuera y recuerdan que tienen que entenderse con la formación morada en el Congreso y en el consejo de ministros.",2021-03-16
862,863,1,5,5,"Montero ha hablado de que Iglesias podría dejar el cargo en torno al 20 de abril, aunque sin concretar una fecha.",2021-03-16
863,864,1,5,5,Menos de 24 horas le ha durado a Iglesias su oferta de unidad en la izquierda.,2021-03-16
864,865,1,5,5,Y en redes también ha reaccionado Iglesias al rechazo de su oferta.,2021-03-16
865,866,1,5,5,Ya se lo pedían los militantes a Iglesias y a Errejón hace años.,2021-03-16
866,867,1,5,5,"En el PP no temen la irrupción de Iglesias, creen que dividirá el voto de la izquierda.",2021-03-16
867,868,1,5,5,"Sánchez repite como el mejor puntuado, seguido de Arrimadas, Casado, Iglesias y Abascal.",2021-03-16
868,869,1,5,5,"Las mujeres estamos cansados de hacer el trabajo sucio, Iñigo Errejón sigue sin hacer declaraciones, para que en el momento histórico, pero ha apoyado en Twitter a la candidata de Más Madrid nos pidan que nos apartemos. y Iglesias ha lamentado la decisión de sus antiguos compañeros de partido.",2021-03-16
869,870,1,5,5,"La mano tendida de Iglesias a Más Madrid, recibe esta rotunda respuesta.",2021-03-16
870,871,1,5,5,"Iglesias lamenta que no hayan recogido su guante A nadie se le escapa que las heridas siguen abiertas entre Iglesias y Errejón, después de que éste dejase Podemos y fundara un nuevo partido para presentarse con Manuela Carmena en Madrid hace dos años Desde Podemos critican que Más Madrid Es un error.",2021-03-16
871,872,1,5,5,Confían en que la izquierda sume el 4M Al otro lado del tablero político El PP pide que Iglesias dimita ya y le ha denunciado ante la junta electoral por anunciar su candidatura desde su despacho de vicepresidente.,2021-03-16
