,id,p0_c1,party_id,candidate_id,phrase,date
1522,1523,0,2,4,"- lo que va pasar el 4 de mayo va ser la clave para que yo llegara a ser presidente del gobierno -el señor Pablo Iglesias, que solo sabe insultar, lo que más le dueles el voto a Vox y por eso se presenta la comunidad de Madrid porque sabe que vos va tener un resultado extraordinario.",2021-03-31
1523,1524,0,2,4,"'La solución más fácil, lógica y racional sería que se aprobase definitivamente la vacuna de AstraZeneca con independencia de la edad' Hoy han sido solo las personas de 60 a 65 años Hoy han sido solo las personas de 60 a 65 años as que han esperado su turno con esta vacuna en el Wanda Metropolitano de Madrid.",2021-03-30
1524,1525,0,2,4,"Solo este fin de semana, en Madrid, se han intervenido más de 380 fiestas ilegales en domicilios.",2021-03-29
1525,1526,0,2,4,"Este fin de semana, en Madrid, se han intervenido más de 380 fiestas solo en domicilios.",2021-03-29
1526,1527,0,2,4,"Madrid presenta más del doble de positivos que hace una semana y suben también, en el País Vasco, donde mañana confinan 19 localidades.",2021-03-28
1527,1528,0,2,4,Podemos ironiza con la situación Podemos ironiza con la situación y Más Madrid la califica de bochornosa. y Más Madrid la califica de bochornosa.,2021-03-28
1528,1529,0,2,4,"En la precampaña madrileña, los socialistas y Más Madrid insisten en llegar acuerdos.",2021-03-28
1529,1530,0,2,4,PSOE y Más Madrid insisten en que los acuerdos serán determinantes.,2021-03-28
1530,1531,0,2,4,"Es fin de semana, a primera hora y ya contamos más de 50 personas a las puertas de este laboratorio de Madrid.",2021-03-28
1531,1532,0,2,4,"En la precampaña madrileña, tanto socialistas como Más Madrid, insisten en llegar acuerdos para vencer a Isabel Díaz Ayuso.",2021-03-28
1532,1533,0,2,4,"También Cataluña aumentan en casi 500 más que hace siete días y fíjense en los datos de Madrid, con más de 2000 positivos registrados hoy, y la diferencia con los menos de 700 del sábado anterior.",2021-03-27
1533,1534,0,2,4,Críticas también a la gestión de Ayuso desde Más Madrid.,2021-03-27
1534,1535,0,2,4,"Madrid merece algo más que una presidenta nini, que ni economía ni salud.",2021-03-27
1535,1536,0,2,4,"Navarra es la que más aumenta la incidencia acumulada, un 42 por ciento desde el lunes, pero la Comunidad de Madrid es la que más nuevos contagios suma.",2021-03-27
1536,1537,0,2,4,"Las críticas de Más Madrid también van dirigidas a la gestiónde Ayuso Madrid merece algo más que una presidenta nini, que ni economía ni salud.",2021-03-27
1537,1538,0,2,4,"Son las dos comunidades, junto con Madrid, con las incidencia más alta, aunque están por encima Ceuta y Melilla.",2021-03-26
1538,1539,0,2,4,"Es uno de los barcos más grandes del mundo ... tiene 400 metros de eslora, 59 de manga... un tamaño mayor que toda la plaza de San Pedro en el Vaticano.. o si lo comparamos con la Castellana en Madrid.. el buque ocupa de largo el doble que el estadio del Bernabeu... son 400 metros.. que superan tambien la altura de la mayor torre de Madrid, la torre de cristal que mide 250 metros y tiene 50 plantas.",2021-03-26
1539,1540,0,2,4,"Y de esos nueve, hay 4 con una incidencia más alta: Melilla, Madrid, el País Vasco y Navarra.",2021-03-25
1540,1541,0,2,4,"El descenso de los ingresos se ha frenado y la ocupación de las UCIs preocupan en autonomías como: Madrid, Cataluña y La Rioja con alrededor de un 25por ciento más de pacientes ingresados que cuando comenzó la tercera ola, según los intensivistas.",2021-03-25
1541,1542,0,2,4,"-Lo único que resulta un poco más preocupantes es Madrid, que teniendo una incidencia muy alta no acaba de tomar decisiones.",2021-03-25
1542,1543,0,2,4,Desde Más Madrid ironizan con el cambio de partido.,2021-03-25
1543,1544,0,2,4,"Mañana 26 en Sevilla, ambiente cálido en Zaragoza, 21 el sábado, y el domingo incluso más calor, 22 en Madrid y 25 en Zaragoza, 21 en León.",2021-03-25
1544,1545,0,2,4,"Para acelerar el ritmo, se están usando espacios más amplios, como el estadio Wanda Metropolitano, en Madrid, o incluso se vacuna sin necesidad de bajar del coche.",2021-03-24
1545,1546,0,2,4,"El polaco Jacub Orlinski, cantante de ópera y uno de los contratenores más valorados del mundo, está esta semana en España, en los Teatros del Canal de Madrid, interpretando sobre todo arias del barroco Pero Orlinski es también célebre a nivel mundial por ser una estrella del breakdance, y nos lo ha demostrado.",2021-03-24
1546,1547,0,2,4,"Y está por debajo del 4por ciento en Madrid, Canarias, País Vasco, Ceuta, Baleares y Melilla, esta última ciudad autónoma no tiene más dosis.",2021-03-24
1547,1548,0,2,4,"Para acelerar el proceso y vacunar al mayor número de personas posibles, cada vez se utilizan espacios más amplios como el estadio Wanda Metropolitano, en Madrid.",2021-03-24
1548,1549,0,2,4,"Es el caso de Ceuta, Cataluña, La Rioja y Madrid, donde empieza a notarse más presión asistencial.",2021-03-23
1549,1550,0,2,4,-Queremos gobernar con Más Madrid y con Ciudadanos.,2021-03-23
1550,1551,0,2,4,"Más Madrid y Podemos creen que si el PSOE quiere evitar que gobierne Ayuso, tendrá que rectificar.",2021-03-23
1551,1552,0,2,4,"-Queremos gobernar con Más Madrid y Ciudadanos, el resto de los planteamientos representan lo de siempre, confrontación y ruido.",2021-03-23
1552,1553,0,2,4,Ni Más Madrid ni Podemos entienden el veto del PSOE.,2021-03-23
1553,1554,0,2,4,Dice que le intranquiliza Prefiere a Más Madrid y a Ciudadanos.,2021-03-22
1554,1555,0,2,4,Me intranquilizaría que alguien en un planteamiento extremista y radical formara parte del gobierno El candidato socialista apuesta por Ciudadanos y Más Madrid.,2021-03-22
1555,1556,0,2,4,Y Errejón aclara que Más Madrid no pondrá vetos.,2021-03-22
1556,1557,0,2,4,Más Madrid es el único partido que ha elegido ya a todos sus miembros.,2021-03-22
1557,1558,0,2,4,Gabilondo mantiene que él prefiere ir con Ciudadanos o Más Madrid antes que con Pablo Iglesias.,2021-03-22
1558,1559,0,2,4,"El Real Madrid sigue agazapado, a seis puntos del Atlético y con un calendario más complicado.",2021-03-22
1559,1560,0,2,4,"Solo en Madrid, se han detectado más de 320 en este puente de San José.",2021-03-21
1560,1561,0,2,4,"La militancia de Más Madrid confirma a la candidata, Mónica García.",2021-03-21
1561,1562,0,2,4,"Mónica García encabezará la lista de Más Madrid, tras contar con el 90por ciento de los votos de su militancia.",2021-03-21
1562,1563,0,2,4,Y Más Madrid se justifica por no ir con Podemos.,2021-03-21
1563,1564,0,2,4,Hoy Equo ha hecho público el acuerdo para concurrir con Más Madrid antes de que esta noche termine el plazo para presentar coaliciones.,2021-03-21
1564,1565,0,2,4,"Comunidad de Madrid, que bajan más de la mitad, y Comunidad Valenciana que sigue con unos registros muy bajos.",2021-03-20
1565,1566,0,2,4,"Mientras, Unidas Podemos vuelve a decir que es un error no ir en coalición con Más Madrid.",2021-03-20
1566,1567,0,2,4,"Mónica García encabezará la lista de Más Madrid el próximo 4 de mayo, según la lista que han validado los inscritos del partido.",2021-03-20
1567,1568,0,2,4,Más Madrid opta por un cuestionario personal para que conozcamos mejor a Mónica García.,2021-03-20
1568,1569,0,2,4,En la Comunidad de Madrid algo más del 3 por ciento de sus habitantes tiene una pauta completa de vacunación.,2021-03-20
1569,1570,0,2,4,En Unidas Podemos creen que es un error no ir coalición con Más Madrid.,2021-03-20
1570,1571,0,2,4,Más Madrid insiste en que no ir en coalición con Unidas Podemos es la mejor decisión.,2021-03-20
1571,1572,0,2,4,"Con la precampaña en marcha, hoy los inscritos de Más Madrid están votando la lista electoral para los comicios.",2021-03-20
1572,1573,0,2,4,Más Madrid aprovecha para presentar a Mónica García con un cuestionario personal.,2021-03-20
1573,1574,0,2,4,"Los ojos están puestos en la procuradora de Ciudadanos que abandonó su grupo, si se produce alguna deserción más entre los naranjas, y en los votos de los procuradores de Unión del Pueblo Leonés y de Por Ávila Pero eso no va a ocurrir, no ha ocurrido en Murcia, no ha ocurrido en Madrid y no va a ocurrir en Castilla y León.",2021-03-20
1574,1575,0,2,4,"Después de una mala semana, en Liga y champions, el Atlético de Madrid es de los 3 candidatos al título quien tiene una jornada supuestamente más propicia.",2021-03-20
1575,1576,0,2,4,"Los más perjudicados son el Real Madrid y el Barcelona, siendo los clubes de Primera los que más dinero mueven y con los ingresos más altos.",2021-03-20
1576,1577,0,2,4,"Cada semana salen de los aeropuertos parisinos alrededor de medio centenar de vuelos, solo con destino a Madrid, muchos de ellos con turistas franceses que buscan en España el sol y más libertad de movimiento.",2021-03-19
1577,1578,0,2,4,En la sierra de Madrid parece que el frío ha disuadido a más de uno y en algunos municipios no han recibido tantos visitantes como esperaban.,2021-03-19
1578,1579,0,2,4,"Y en su nuevo disco, Sting ha elegido no cantar solo: En el álbum que se publica hoy, el artista británico recupera las colaboraciones más queridas a lo largo de su carrera, como los temas que comparte con Erick Clapton, Julio Iglesias o Zucchero El Real Madrid se enfrentará al Liverpool en los cuartos de final de la Champions League.",2021-03-19
1579,1580,0,2,4,"Cada semana de los aeropuertos salen un centenar de aviones con destino a Madrid, con turistas que buscan el sol y más libertad de movimientos.",2021-03-19
1580,1581,0,2,4,"Dos días después del no de Más Madrid a una lista unitaria con Unidas Podemos, Iñigo Errejón reconoce que no tiene comunicación con Pablo Iglesias y le lanza este mensaje.",2021-03-19
1581,1582,0,2,4,"-Creo que hacen falta posiciones que se tomen en serio Madrid, que no se lo tomen como un trozo, una parte de cálculos más grandes.",2021-03-19
1582,1583,0,2,4,"Dos días después del no de Más Madrid a una lista unitaria con Unidas Podemos, Iñigo Errejón reconoce que no tiene comunicación con Pablo Iglesias y le lanza este mensaje.",2021-03-18
1583,1584,0,2,4,"-Creo que hacen falta posiciones que se tomen en serio Madrid, que no se lo tomen como un trozo, una parte de cálculos más grandes.",2021-03-18
1584,1585,0,2,4,El líder de Más Madrid desvela que no tiene comunicación con Iglesias.,2021-03-18
1585,1586,0,2,4,"-Hace falta fuerza posiciones y fuerzas progresistas que se tomen en serio Madrid, que no se lo tomen como un digamos, como un trozo, como una parte de cálculos más grandes.",2021-03-18
1586,1587,0,2,4,"Tras anunciar que dejaba el Gobierno para ser candidato en Madrid, Pablo Iglesias planteó ayer una candidatura conjunta entre Unidas Podemos y Más Madrid para las elecciones madrileñas del 4 de mayo.",2021-03-16
1587,1588,0,2,4,"Esa era la respuesta de Mónica García, la candidata de Más Madrid, que ha recibido el apoyo de Errejón en Twitter.",2021-03-16
1588,1589,0,2,4,"Y una información más: La reina Sofía, de 82 años, se ha vacunado hoy en un centro de salud de Madrid y siguiendo -dice Zarzuela- los protocolos establecidos por las autoridades sanitarias.",2021-03-16
1589,1590,0,2,4,"Así respondía la candidata de Más Madrid, Mónica García, a la oferta de Pablo Iglesias para ir juntos el 4 de mayo en las elecciones de Madrid.",2021-03-16
1590,1591,0,2,4,"A Más Madrid no le gustaron ni las formas, ni el contenido.",2021-03-16
1591,1592,0,2,4,"Podemos y Más Madrid rivalizarán en las urnas, con un fin, echar a Ayuso.",2021-03-16
1592,1593,0,2,4,"-Según los sindicatos las oficinas de Madrid, Barcelona, Valencia o Baleares, ya de por si saturadas por la pandemia, podrían tardar más en recuperar el ritmo.",2021-03-16
1593,1594,0,2,4,"Madrid es la única comunidad con más de 200, además de Ceuta y Melilla.",2021-03-16
1594,1595,0,2,4,"Falta trabajo, hay ausencia de recursos, España está cada vez más focalizado en el centro, Madrid, o las capitales grandes.",2021-03-16
1595,1596,0,2,4,"Delante un cantautor que ha tocado ante 10 000 personas en Madrid, más de un disco suyo ha ido directo al top de ventas, pero un manuscrito aún le pesa.",2021-03-16
1596,1597,0,2,4,"Las mujeres estamos cansados de hacer el trabajo sucio, Iñigo Errejón sigue sin hacer declaraciones, para que en el momento histórico, pero ha apoyado en Twitter a la candidata de Más Madrid nos pidan que nos apartemos. y Iglesias ha lamentado la decisión de sus antiguos compañeros de partido.",2021-03-16
1597,1598,0,2,4,"Más Madrid, el partido de Iñigo Errejón le dice NO a Pablo Iglesias.",2021-03-16
1598,1599,0,2,4,"La mano tendida de Iglesias a Más Madrid, recibe esta rotunda respuesta.",2021-03-16
1599,1600,0,2,4,"Iglesias lamenta que no hayan recogido su guante A nadie se le escapa que las heridas siguen abiertas entre Iglesias y Errejón, después de que éste dejase Podemos y fundara un nuevo partido para presentarse con Manuela Carmena en Madrid hace dos años Desde Podemos critican que Más Madrid Es un error.",2021-03-16
1600,1601,0,2,4,"Ahora, el objetivo es echar a Ayuso dicen algo que comparten desde el PSOE que no entra a valorar la decisión de Más Madrid.",2021-03-16
1601,1602,0,2,4,"Muy por encima de esta media están Melilla y Ceuta... seguidas de la Comunidad de Madrid, con más de 200.",2021-03-16
1602,1603,0,2,4,"Más cambios, La policía busca en Madrid al conductor de un patinete eléctrico que el domingo atropelló a una mujer de 79 años que ha fallecido a causa de las heridas.",2021-03-16
1603,1604,0,2,4,"Tiene que remontar el 0-1 de la ida ante el Chelsea y esta noche el Madrid, más fácil, que recibe al Atalanta y defiende el 0-1 de la ida.",2021-03-16
1604,1605,0,2,4,"-Por eso voy a proponer a los compañeros de Más Madrid, que aunque sigamos siendo organizaciones y espacios diferentes hagamos una candidatura unitaria para ganar Madrid el próximo 4 de mayo.",2021-03-15
1605,1606,0,2,4,"El contraste lo hemos encontrado en las ciudades más contaminantes, en Madrid y Barcelona, donde su índice de calidad mejoró de forma muy notable.",2021-03-15
1606,1607,0,2,4,Un militante debe estar allí donde es más útil en cada momento Madrid necesita un gobierno de izquierdas y creo que puedo ser útil ayudando a ganarlo y liderándolo.,2021-03-15
1607,1608,0,2,4,"Iñigo Errejón guarda silencio, pero la candidata de Más Madrid dice que se sentarán a hablar con Iglesias.",2021-03-15
1608,1609,0,2,4,Estamos en Madrid y Barcelona para hacer memoria de las horas más angustiosas en hospitales y residencias.,2021-03-15
1609,1610,0,2,4,"Voy a proponer a los compañeros de Más Madrid, que aunque sigamos siendo organizaciones diferentes, hagamos una candidatura unitaria, para ganar Madrid el próximo 4 de mayo.",2021-03-15
1610,1611,0,2,4,"-La reacción más esperada era la de Ayuso, se muestra convencida de que su candidatura va a aglutinar a todos los que no quieren a Pablo Iglesias al frente de Madrid, y tira de sorna, dice que España le debe una por sacarle de Moncloa.",2021-03-15
1611,1612,0,2,4,"La candidatura de Pablo Iglesias y su salida del gobierno obliga a mover ficha, Ángel Gabilondo guarda silencio, y desde Más Madrid adelantan que se sentarán a hablar.",2021-03-15
1612,1613,0,2,4,"Y vamos a situarnos en el centro de Madrid, en una de sus calles más representativas.",2021-03-15
1613,1614,0,2,4,"Más del 40por ciento de las muertes han sido en residencias como estas, sobre todo en Madrid y Cataluña.",2021-03-15
1614,1615,0,2,4,"Explica que a las 12:25 del pasado miércoles, Díaz Ayuso firmó el documento de disolución de la Asamblea, con el objetivo de celebrar nuevos comicios, y que no fue hasta las 13:03 y las 13:07 cuando se presentaron las mociones de censura de Más Madrid y PSOE.",2021-03-14
1615,1616,0,2,4,Tanto Unidas Podemos como Más Madrid auguran que estas elecciones le darían más oxígeno a Vox en un futuro Gobierno.,2021-03-14
1616,1617,0,2,4,Más Madrid insiste en que las mociones de censura deben de prevalecer frente a las elecciones.,2021-03-14
1617,1618,0,2,4,"Si el Tribunal da la razón a los letrados de la Asamblea, que solicitaron medidas cautelarísimas, la convocatoria de elecciones quedará paralizada y se llevarán a cabo las mociones de censura contra Ayuso, que presentaron el PSOE y Más Madrid.",2021-03-13
1618,1619,0,2,4,"En Más Madrid esperan que la justicia haga prevalecer las mociones de censura sobre la convocatoria de elecciones, pero aseguran estar preparados para todo.",2021-03-13
1619,1620,0,2,4,"También es el caso de Madrid, que presenta unos 70 contagios más que hace siete días, pero bajan, aunque levemente, en Cataluña y también en Andalucía y la Comunidad Valenciana con respecto al sábado anterior.",2021-03-13
1620,1621,0,2,4,"En unas de las tiendas de souvenirs que más vende en Madrid, ahora solo suena la radio.",2021-03-13
1621,1622,0,2,4,"Más Madrid confía en que la justicia prevalezca las mociones antes que las elecciones, aunque dicen, están preparados.",2021-03-13
1622,1623,0,2,4,"En una de las tiendas de souvenirs que más vende en Madrid, ahora solo suena la radio.",2021-03-13
1623,1624,0,2,4,"En el Real Madrid prefieren estar más pendientes del inminente choque ante el Elche y de los regresos de Ramos y Hazard, que del hipotético retorno de Cristiano Ronaldo.",2021-03-13
1624,1625,0,2,4,"Aguado coincide con Más Madrid en denunciar la falta de responsabilidad, dicen, de Díaz Ayuso.",2021-03-12
1625,1626,0,2,4,En Madrid el futuro político más inmediato se va a decidir en los tribunales.,2021-03-11
1626,1627,0,2,4,La clave está en saber qué prevalece: la convocatoria de elecciones o las mociones de PSOE y Más Madrid.,2021-03-11
1627,1628,0,2,4,Lo más probable es que se presente mañana primera hora de la mañana. el TSJ de Madrid. tiene 2 días para resolver el recurso. se abren 2 escenarios.,2021-03-11
1628,1629,0,2,4,"Minutos más tarde, PSOE y Más Madrid Madrid registran mociones de censura para intentar un vuelco.",2021-03-10
1629,1630,0,2,4,Más Madrid y PSOE presentaban dos mociones de censura.,2021-03-10
1630,1631,0,2,4,Los de Simeone ya han jugado los mismos partidos que Barça y Real Madrid y tienen 6 puntos más que los azulgrana y 8 más que el equipo blanco.,2021-03-10
1631,1632,0,2,4,"La duda ahora es si se celebrarán esas elecciones anticipadas porque casi, a la misma hora Más Madrid y el PSOE han registrado sendas mociones de censura contra la presidenta de la Comunidad.",2021-03-10
1632,1633,0,2,4,Pero PSOE y Más Madrid aseguran que la disolución del parlamento regional solo es oficial cuando se publica.,2021-03-10
1633,1634,0,2,4,"Casi a la misma hora Más Madrid comunicaba vía Twitter, que habían registrado una moción.",2021-03-10
1634,1635,0,2,4,"Y les hablamos de esto porque esta corriente cálida trae una temperatura más cálida a Europa, por ejemplo en Nueva York estamos con temperaturas más frías que en Madrid o en Barcelona que están a latitudes parecidas.",2021-03-10
1635,1636,0,2,4,La Mesa de la Asamblea acaba de decidir que no está disuelta y está estudiando las mociones de PSOE y Más Madrid.,2021-03-10
1636,1637,0,2,4,"La duda ahora es si se celebrarán esas elecciones anticipadas porque casi, a la misma hora Más Madrid y el PSOE han registrado sendas mociones de censura En los deportes, el Sevilla fuera de la Champions, a pesar de hacer una buena eliminatoria.",2021-03-10
1637,1638,0,3,3,"El Partido Popular intenta justificar el no hacer ese cordón sanitario porque, en el fondo, cuenta con la ultraderecha para conformar sus propios gobiernos.",2021-04-27
1638,1639,0,3,3,"El Partido Popular condena los hechos y llama a recuperar la convivencia, al igual que Ciudadanos.",2021-04-26
1639,1640,0,3,3,"Condena también del presidente del Gobierno en Twitter y de la candidata del Partido Popular, que asegura que estos actos no tienen sentido en un país en libertad.",2021-04-26
1640,1641,0,3,3,"El Partido Popular no se cree el sondeo, en su opinión el CIS no tiene ningún prestigio.",2021-04-22
1641,1642,0,3,3,Acabamos de saber que el Tribunal Constitucional ha admitido a trámite los recursos presentados por el Partido Popular y Vox contra la ley de educación aprobada el pasado mes de diciembre.,2021-04-21
1642,1643,0,3,3,El Partido Popular deja clara su postura.,2021-04-20
1643,1644,0,3,3,"-Creo que el Partido Popular, si me permiten esta expresión, está en redando con este tema del estado de alarma y no sabe ni lo que quiere.",2021-04-20
1644,1645,0,3,3,"Desde la oposición, el Partido Popular critica que no se conozcan las medidas comprometidas con Bruselas para reformar las pensiones.",2021-04-13
1645,1646,0,3,3,Esta tarde el Partido Popular ha recurrido ya al Tribunal Constitucional la sentencia que sacó de su candidatura en Madrid al exdirigente de Ciudadanos Toni Cantó.,2021-04-12
1646,1647,0,3,3,La sentencia excluye a Toni Cantó y a Agustín Conde como candidatos de las listas del Partido Popular por Madrid.,2021-04-11
1647,1648,0,3,3,El Partido Socialista defiende su estrategia de vacunación y acusa al Partido Popular de ir a favor del virus.,2021-04-11
1648,1649,0,3,3,"Con las vacunas como centro de la polémica política, El partido socialista acusa al partido popular de sembrar dudas sobre la vacuna y de ir, dicen, a favor del virus.",2021-04-11
1649,1650,0,3,3,"Las quejas llegan de las comunidades gobernadas por el Partido Popular, que acusan al Gobierno de dejarles desprotegidos.",2021-04-07
1650,1651,0,3,3,-El Partido Popular entregará a Vox todo lo que sea necesario.,2021-04-05
1651,1652,0,3,3,-Es un Partido Popular muy singular.,2021-04-05
1652,1653,0,3,3,"'Nosotros condenamos todos los ataques, vengan de donde vengan, pero sin embargo ha habido ataques a sedes del Partido Popular que Podemos no ha condenado'.",2021-04-02
1653,1654,0,3,3,Esos tres diputados expulsados del partido de Abascal fueron clave para que no prosperara la moción de censura que PSOE y Ciudadanos contra el popular López Miras.,2021-04-01
1654,1655,0,3,3,Y ese dilema se traduce hoy en más viviendo pública o más especulación' El Partido Popular responde y acusa al PSOE de tener una doble moral.,2021-03-28
1655,1656,0,3,3,El Partido Popular acusa al PSOE de doble moral por gobernar en España con Podemos.,2021-03-28
1656,1657,0,3,3,El Partido Popular acusa al PSOE de doble moral por gobernar en España con Podemos.,2021-03-28
1657,1658,0,3,3,"Para el Partido Popular, el PSOE tiene doble moral.",2021-03-28
1658,1659,0,3,3,Ha asegurado hoy ante el juez del caso Púnica que nunca ha dado dinero al Partido Popular.,2021-03-25
1659,1660,0,3,3,-No ha habido caja B del Partido Popular y por supuesto yo no he triturado lo que nunca tuve en mis manos.,2021-03-24
1660,1661,0,3,3,-Da pena ver al Partido Popular liderado por usted.,2021-03-24
1661,1662,0,3,3,"El Partido Popular ha acusado presidente del gobierno, de intentar acabar con ellos en Murcia, Castilla y León y Madrid.",2021-03-24
1662,1663,0,3,3,"La caja paralela o la caja B del Partido Popular no existe, no era del partido popular, repito.",2021-03-23
1663,1664,0,3,3,"Sería de la persona que la hizo, pero no era del Partido Popular.",2021-03-23
1664,1665,0,3,3,"-Yo jamás he conocido, manejado ni creado ninguna caja B. -No soy ni el único Javier que aparece en los papeles ni el único Javier del Partido Popular.",2021-03-23
1665,1666,0,3,3,No soy el único Javier que aparece en los papeles ni el único Javier del Partido Popular.,2021-03-23
1666,1667,0,3,3,"Es aquí, donde el Partido Popular inventó la caja B, por eso esta moción de censura.",2021-03-22
1667,1668,0,3,3,Que por higiene democrática y por dignidad propia ante la campaña del partido popular para fagocitares rompan todos sus pactos de gobiernos con el PP en aytos y CCAA empezando por Castilla y león.,2021-03-22
1668,1669,0,3,3,El Partido Popular cree que Iglesias debería dejar el acta de diputado.,2021-03-21
1669,1670,0,3,3,El Partido Popular cree que Iglesias debería dejar el acta de diputado.,2021-03-21
1670,1671,0,3,3,El partido popular tira de ironía.,2021-03-20
1671,1672,0,3,3,"-El Partido Popular se ha escorado hacia la ultraderecha y, además, está haciendo de Madrid un laboratorio de pruebas del trumpismo.",2021-03-19
1672,1673,0,3,3,-Esta ley solamente podría salir si se sigue adelante con el incumplimiento del acuerdo de Gobierno con el apoyo del Partido Popular.,2021-03-19
1673,1674,0,3,3,"-El Partido Popular se ha escorado hacia la ultraderecha y, además, está haciendo de Madrid un laboratorio de pruebas del trumpismo.",2021-03-18
1674,1675,0,3,3,-Esta ley solamente podría salir si se sigue adelante con el incumplimiento del acuerdo de Gobierno con el apoyo del Partido Popular.,2021-03-18
1675,1676,0,3,3,"Es uno de los proyectos estrellas del PSOE. 202 votos a favor, todos los grupos es este el Partido Popular y vos.",2021-03-18
1676,1677,0,3,3,"Luis Bárcenas ha apuntado que Mariano Rajoy estaba tras la operación Kitchen, montada presuntamente desde Interior para extraer información al extesorero que pudiera comprometer al Partido Popular.",2021-03-17
1677,1678,0,3,3,"-Como buen secretario general del Partido Popular, se ha dedicado a comprase diputados de Ciudadanos.",2021-03-17
1678,1679,0,3,3,"'Como bien secretario general del Partido Popular, se ha dedicado a comprarse diputados de Ciudadanos.",2021-03-17
1679,1680,0,3,3,"Esa división de la izquierda se percibe como una buena noticia en el otro bloque en el que están Partido Popular, Vox y Ciudadanos.",2021-03-16
1680,1681,0,3,3,"Re junto a l siglas del Partido Popular, se aglutinaron todos los votos.",2021-03-15
1681,1682,0,3,3,"Desconocía y desconozco la existencia de una caja B, ni de dinero B en el Partido Popular en ningún momento.",2021-03-15
