,id,p0_c1,party_id,candidate_id,phrase,date
2328,2329,0,4,1,"El PP supera al PSOE, a Más Madrid y a Unidas Podemos.",2021-04-05
2329,2330,0,4,1,"Para romper el empate entre bloques, el PSOE y Más Madrid tratan de movilizar a la izquierda.",2021-04-05
2330,2331,0,4,1,"Rechaza así la denuncia del PSOE que aseguraba que el ex de Ciudadanos, Toni Cantó, no cumplía con los requisitos al no haberse empadronado en Madrid antes del 1 de enero.",2021-04-05
2331,2332,0,4,1,"Sumarían 68 escaños, los mismos que el PSOE, Mas Madrid y Podemos.",2021-04-05
2332,2333,0,4,1,"El PSOE tendría un escaño más que hace dos años, y se quedaría con 38.",2021-04-05
2333,2334,0,4,1,"El otro titular que nos deja esta encuesta es que los dos bloques, de derecha e izquierda empatan y ninguno alcanza la mayoría absoluta de 69 PP y Vox sumarían 68, lo mismo que PSOE, Más Madrid y Unidas Podemos.",2021-04-05
2334,2335,0,4,1,PSOE y Más Madrid lo asumen.,2021-04-05
2335,2336,0,4,1,Y afirma que es Sanchez el único que maneja los hilos en el PSOE.,2021-04-04
2336,2337,0,4,1,Los populares han denunciado hoy ante la Junta Electoral al PSOE.,2021-04-03
2337,2338,0,4,1,"El PSOE denuncia ante la Junta Electoral, que no está empadronado en Madrid.",2021-04-03
2338,2339,0,4,1,Psoe y Más Madrid critican a Isabel Díaz Ayuso por el proceso de vacunación en Madrid.,2021-04-03
2339,2340,0,4,1,Solidaridad desde PSOE y Más País.,2021-04-02
2340,2341,0,4,1,"Precisamente por él, el PSOE ha impugnado la candidatura de Díaz Ayuso.",2021-04-02
2341,2342,0,4,1,El PSOE ha colocado un cartel de grandes dimensiones de Ángel Gabilondo en la céntrica plaza de Callao.,2021-04-02
2342,2343,0,4,1,Esos tres diputados expulsados del partido de Abascal fueron clave para que no prosperara la moción de censura que PSOE y Ciudadanos contra el popular López Miras.,2021-04-01
2343,2344,0,4,1,Ha sido negociadora de Podemos con el PSOE en Presupustos y Vivienda.,2021-03-30
2344,2345,0,4,1,El PP acusa al PSOE de doble moral por pactar con Podemos y Bildu.,2021-03-28
2345,2346,0,4,1,Y ese dilema se traduce hoy en más viviendo pública o más especulación' El Partido Popular responde y acusa al PSOE de tener una doble moral.,2021-03-28
2346,2347,0,4,1,"Con la mano tendida, Mónica García se abre a llegar a un posible acuerdo con PSOE y Cs.",2021-03-28
2347,2348,0,4,1,"También el Ayuntamiento cacereño, gobernado por el PSOE, se ha pronunciado en contra de la mina en dos ocasiones, con el apoyo de todos los grupos, salvo Ciudadanos.",2021-03-28
2348,2349,0,4,1,PSOE y Más Madrid insisten en que los acuerdos serán determinantes.,2021-03-28
2349,2350,0,4,1,El Partido Popular acusa al PSOE de doble moral por gobernar en España con Podemos.,2021-03-28
2350,2351,0,4,1,El Partido Popular acusa al PSOE de doble moral por gobernar en España con Podemos.,2021-03-28
2351,2352,0,4,1,"Para el Partido Popular, el PSOE tiene doble moral.",2021-03-28
2352,2353,0,4,1,Y aseguran que el PSOE lo hará con Podemos.,2021-03-28
2353,2354,0,4,1,"Preguntada por si se vería en un Gobierno con PSOE y Ciudadanos, Mónica García tiende la mano.",2021-03-28
2354,2355,0,4,1,"Quien quiera estar en un Gobierno progresista, liderado por PSOE y Ángel Gabilondo deberá renunciar al extremismo.",2021-03-27
2355,2356,0,4,1,"Quien quiera estar en un Gobierno progresista, liderado por PSOE y Ángel Gabilondo deberá renunciar al extremismo.",2021-03-27
2356,2357,0,4,1,"El nuevo Consejo de Administración, elegido con el consenso de PSOE, PP, Unidas Podemos y PNV, se ha reunido esta tarde.",2021-03-26
2357,2358,0,4,1,"Tras él, han pasado los nueve consejeros, cuatro mujeres y cinco hombres, elegidos también por consenso entre PSOE, PP, Unidas Podemos y PNV.",2021-03-26
2358,2359,0,4,1,"Candidato de consenso de PSOE, PP, Unidas Podemos y PNV, defiende el acuerdo para que los medios públicos cumplan su función en un momento tan difícil como es la pandemia.",2021-03-26
2359,2360,0,4,1,"Al frente, el profesor universitario y periodista de 66 años José Manuel Pérez Tornero, candidato de consenso de PSOE, PP, Unidas Podemos y PNV.",2021-03-26
2360,2361,0,4,1,"La moción de censura presentada por PSOE, Ciudadanos y Podemos ha salido adelante y apea de la alcaldía al popular José Ballesta.",2021-03-25
2361,2362,0,4,1,"La elección parte del consenso de PSOE, PP, Unidas Podemos y PNV.",2021-03-25
2362,2363,0,4,1,El PSOE no gobernaba en el ayuntamiento desde hace 26 años.,2021-03-25
2363,2364,0,4,1,"No ha habido sorpresas de última hora y la moción de censura en el Ayuntamiento ha salido adelante con los votos del Psoe, Ciudadanos y Podemos...",2021-03-25
2364,2365,0,4,1,"La expectación se ha mantenido hasta el último momento porque solo un voto sea decantado para esta moción de censura con los 15 concejales del PSOE, en contra de los 14 del PP y de Vox.",2021-03-25
2365,2366,0,4,1,"El PSOE vuelve a gobernar en Murcia, la 7 capital de España, después de 26 años con gobiernos del PP.",2021-03-25
2366,2367,0,4,1,"El laboratorio de pruebas del sr. Sánchez, del sr. Iglesias y de la sra. Arrimadas, de Podemos, PSOE y Ciudadanos no es una buena noticia.",2021-03-25
2367,2368,0,4,1,"PSOE, PP y Unidas Podemos dicen que es un paso necesario para terminar la etapa de provisionalidad.",2021-03-25
2368,2369,0,4,1,"Son Ramón Colom, Concepción Carmen Cascajosa, Roberto Lakidain y Consuelo Aparicio, los candidatos acordados entre PSOE, PP, Unidas Podemos y PNV.",2021-03-24
2369,2370,0,4,1,Irene Lozano deja la presidencia del Consejo Superior de Deportes para incorporarse a la listas del PSOE de Madrid para las elecciones del 4 de mayo.,2021-03-24
2370,2371,0,4,1,"Son Ramón Colom, Concepción Carmen Cascajosa, Roberto Lakidain y Consuelo Aparicio, los candidatos acordados entre PSOE, PP, Unidas Podemos y PNV.",2021-03-24
2371,2372,0,4,1,El candidato del PSOE repite que no pactará con Pablo Iglesias.,2021-03-23
2372,2373,0,4,1,"-Si el número uno manda poco en el PSOE, imagino que el dos muchomenos El PP no da credibilidad al veto de Gabilondo a Iglesias.",2021-03-23
2373,2374,0,4,1,"Más Madrid y Podemos creen que si el PSOE quiere evitar que gobierne Ayuso, tendrá que rectificar.",2021-03-23
2374,2375,0,4,1,"PSOE, PP y Vox han rechazado su tramitación siguiendo el criterio de los letrados que dicen que la iniciativa es inconstitucional.",2021-03-23
2375,2376,0,4,1,Ni Más Madrid ni Podemos entienden el veto del PSOE.,2021-03-23
2376,2377,0,4,1,"PSOE, PP y VOX han votado en contra de que se tramite.",2021-03-23
2377,2378,0,4,1,No ha habido sorpresas de última hora y las Cortes de Castilla y León han rechazado la moción de cesura del PSOE contra el gobierno de PP y Ciudadanos.,2021-03-22
2378,2379,0,4,1,Y así de contundente se ha expresado el candidato del PSOE en Madrid sobre sus preferencias para un hipotético gobierno tras el 4 de mayo.,2021-03-22
2379,2380,0,4,1,"Respuesta al candidato del PSOE que en un debate crispado ha cargado contra Ciudadanos por traicionar, dice, sus promesas de regeneración.",2021-03-22
2380,2381,0,4,1,"Incógnita es también la lista de Podemos y la del PSOE, donde podría haber sorpresa.",2021-03-22
2381,2382,0,4,1,En Castilla y León se está debatiendo la moción de censura presentada por el PSOE contra el gobierno de PP y C's que preside Alfonso Fernández Mañueco.,2021-03-22
2382,2383,0,4,1,El PSOE y Podemos suman 37 votos pero necesitan el apoyo de cuatro procuradores más.,2021-03-22
2383,2384,0,4,1,"Ciudadanos que el viernes perdió a una de sus representantes, confía en que ninguno de los 11 procuradores que siguen en el grupo, apoye la moción, pese al último llamamiento de la dirección del PSOE.",2021-03-22
2384,2385,0,4,1,"La ha presentado el PSOE contra el Gobierno de PP y Ciudadanos y puede ser la segunda que pierdan los socialistas en una semana, porque a esta hora siguen sin tener los apoyos necesarios.",2021-03-22
2385,2386,0,4,1,El candidato del PSOE califica así el gobierno de coalición entre PP y Ciudadanos Y hace un llamamiento para que la moción que ha presentando en solitario prospere LUIS TUDANCA PSOE.,2021-03-22
2386,2387,0,4,1,"Si no hay sorpresas, esta será la segunda moción del PSOE que no prosperaría.",2021-03-22
2387,2388,0,4,1,Y se hace una pregunta ¿Cómo es posible que el gobierno de la nación y el PSOE se hayan embarcado en la desestabilización de gobiernos de las comunidades autónomas en los momentos que estamos viviendo?,2021-03-22
2388,2389,0,4,1,El primero en hablar de sus preferencias ha sido el candidato del Psoe.,2021-03-22
2389,2390,0,4,1,"Han llevado su protesta, también, ante la sede del PSOE.",2021-03-22
2390,2391,0,4,1,"Desde el PSOE apelan al votante de Ciudadanos, clave, dicen, para decantar estas elecciones.",2021-03-21
2391,2392,0,4,1,"Tras la que fracasó en la Región de Murcia, el resultado de la presentada por el PSOE en Castilla y León está en el aire.",2021-03-21
2392,2393,0,4,1,"Las Cortes de Castilla y León tienen 81 escaños, por lo que el PSOE necesita 41 votos para obtener la mayoría absoluta, imprescindible para que triunfe la moción de censura.",2021-03-21
2393,2394,0,4,1,"Su vicepresidente, Francisco Igea, de Ciudadanos, también se ha mostrado contrario a la moción desde que el PSOE anunció la noticia.",2021-03-21
2394,2395,0,4,1,El todavía vicepresidente segundo del Gobierno inicia precampaña señalando a PP y a PSOE.,2021-03-21
2395,2396,0,4,1,El PP afirma que a PSOE y Podemos les molesta que una mujer sea referente en gestión y Ciudadanos insiste en que no desaparecerán.,2021-03-20
2396,2397,0,4,1,Ángel Gabilondo el candidato del PSOE responde a quienes le llaman serio y lo convierte en su lema de campaña.,2021-03-20
2397,2398,0,4,1,La última propuesta del PSOE para la ley de Vivienda provoca una nueva confrontación en el Gobierno.,2021-03-20
2398,2399,0,4,1,El PSOE apuesta por colaborar con los propietarios.,2021-03-20
2399,2400,0,4,1,El PP afirma que a PSOE y Podemos les molesta que una mujer sea referente en gestión.,2021-03-20
2400,2401,0,4,1,'Gobernar en serio' es el lema del PSOE para la campaña.,2021-03-20
2401,2402,0,4,1,"Para el PP, lo que está haciendo el PSOE es intentar desestabilizar a su partido.",2021-03-20
2402,2403,0,4,1,"Ángel Gabilondo, el candidato del PSOE, Ángel Gabilondo, el candidato del PSOE, responde a quienes le llaman serio y lo convierte en su lema de campaña.",2021-03-20
2403,2404,0,4,1,El presidente de Castilla y León asegura que la moción de censura presentada por el PSOE no prosperará Los socialistas necesitan sumar a sus votos y a los de Podemos al menos los de cuatro procuradores más.,2021-03-20
2404,2405,0,4,1,La última propuesta del PSOE para la ley de Vivienda provoca una nueva confrontación en el Gobierno.,2021-03-20
2405,2406,0,4,1,El PSOE apuesta por colaborar con los propietarios.,2021-03-20
2406,2407,0,4,1,"Eso debilita el gobierno de PP y Ciudadanos allí y podría alterar la moción del PSOE, que se debate el lunes.",2021-03-19
2407,2408,0,4,1,Desde hace semanas las discrepancias entre PSOE y Unidas Podemos por la futura ley de Vivienda han incrementado la tensión entre los socios.,2021-03-19
2408,2409,0,4,1,"El PSOE propone que los propietarios tengan reducciones fiscales si rebajan el alquiler, o bien si se alquila a jóvenes o se ceden los pisos a programas públicos.",2021-03-19
2409,2410,0,4,1,"Iglesias mete presión al PSOE, su intención es sacar adelante la Ley de Vivienda antes de marcharse del Gobierno.",2021-03-19
2410,2411,0,4,1,"Mantiene su escaño, a tres días de la moción de censura del PSOE contra Mañueco.",2021-03-19
2411,2412,0,4,1,Pablo Iglesias mantiene el pulso con el PSOE por la ley de vivienda.,2021-03-19
2412,2413,0,4,1,"Al populismo de derechas, dice, ya le ha abierto la puerta el PP, tras la moción de censura de PSOE y Ciudadanos que fracasó ayer.",2021-03-19
2413,2414,0,4,1,Y vuelve a meter presión a al PSOE con la Ley de Vivienda.,2021-03-19
2414,2415,0,4,1,"Después de unos días frenéticos, hoy en Murcia no ha habido sorpresas de última hora, la moción de censura de PSOE y Ciudadanos ha sido rechazada.",2021-03-19
2415,2416,0,4,1,"En Castilla y León, será el lunes cuando se debata la moción de censura que ha presentado el PSOE contra el popular Fernández Mañueco, que gobierna en coalición con Ciudadanos.",2021-03-19
2416,2417,0,4,1,Unidas Podemos ha cargado contra el PSOE por proponer incentivos fiscales y le advierte de que tendrá que cambiar de socio para aprobar la ley si no acepta limitar los precios.,2021-03-19
2417,2418,0,4,1,El PSOE dice que negociar es cumplir el acuerdo de coalición y que no hay nada cerrado.,2021-03-19
2418,2419,0,4,1,-El PSOE tiene 120 escaños y no va quitarle la responsabilidad enorme que tiene de interpretarle en este momento cuáles son los pasos que vamos a dar.,2021-03-19
2419,2420,0,4,1,"Después de unos días frenéticos, hoy en Murcia no ha habido sorpresas de última hora, la moción de censura de PSOE y Ciudadanos ha sido rechazada.",2021-03-18
2420,2421,0,4,1,"En Castilla y León, será el lunes cuando se debata la moción de censura que ha presentado el PSOE contra el popular Fernández Mañueco, que gobierna en coalición con Ciudadanos.",2021-03-18
2421,2422,0,4,1,Unidas Podemos ha cargado contra el PSOE por proponer incentivos fiscales y le advierte de que tendrá que cambiar de socio para aprobar la ley si no acepta limitar los precios.,2021-03-18
2422,2423,0,4,1,El PSOE dice que negociar es cumplir el acuerdo de coalición y que no hay nada cerrado.,2021-03-18
2423,2424,0,4,1,-El PSOE tiene 120 escaños y no va quitarle la responsabilidad enorme que tiene de interpretarle en este momento cuáles son los pasos que vamos a dar.,2021-03-18
2424,2425,0,4,1,"Con 23 votos en contra, frente a los 21 votos a favor, la iniciativa de PSOE y CS que sacudió el mapa político la semana pasada, ha sido tumbada.",2021-03-18
2425,2426,0,4,1,Fracasa el intento de PSOE y Ciudadanos en Murcia de desalojar del gobierno al popular López Miras.,2021-03-18
2426,2427,0,4,1,"Pero el líder del PSOE insistía durante el debate, en que ha servido para dejar claro que el PP es capaz de comprar apoyos, para seguir en el poder.",2021-03-18
2427,2428,0,4,1,"La otra moción de censura en de PSOE y CS, la del Ayuntamiento de Murcia, se debatirá el día 25 de marzo y esta si parece que saldría adelante.",2021-03-18
2428,2429,0,4,1,"Y el lunes se debatirá y votará la moción de censura del PSOE contra el popular Fernández Mañueco, que gobierna Castilla y León en coalición con Ciudadanos.",2021-03-18
2429,2430,0,4,1,El Psoe reclama responsabilidad a su socio y dice que todavía hay margen para negociar.,2021-03-18
2430,2431,0,4,1,Unidas Podemos recuerda al PSOE que el acuerdo de coalición contempla la limitación del precio de los alquileres.,2021-03-18
2431,2432,0,4,1,"Es uno de los proyectos estrellas del PSOE. 202 votos a favor, todos los grupos es este el Partido Popular y vos.",2021-03-18
2432,2433,0,4,1,"Salvo sorpresas de última hora, la moción de censura de PSOE y Ciudadanos en Murcia no saldrá adelante.",2021-03-17
2433,2434,0,4,1,Con duros ataques del PSOE a los populares.,2021-03-17
2434,2435,0,4,1,Fuentes de Unidas Podemos critican que el PSOE no incluya la limitación de precios pactada en el acuerdo de Gobierno.,2021-03-17
2435,2436,0,4,1,"Y en Murcia, los tres diputados expulsados de Vox acaban de anunciar que votarán en contra de la moción de censura presentada por PSOE y Ciudadanos.",2021-03-17
2436,2437,0,4,1,"El origen de la convulsión política de estos días fue la moción de censura en Murcia contra el popular López Miras, presentada por PSOE y Ciudadanos hace justo una semana Una moción que no saldrá adelante porque los tres diputados expulsados de Vox acaban de anunciar que votaran en contra Manuel Segura El portavoz expulsado de Vox, acaba de anunciar a la puerta de al asamblea que van a votar que no, así que la moción de censura no va a prosperar, necesitaban 23 votos y se van a quedar en 21, acaban de anunciar los 3 diputados que no van a apoyarla.",2021-03-17
2437,2438,0,4,1,"Debate con constantes acusaciones Empezando por las de los firmantes de la moción: Las del PSOE, directas al PP.",2021-03-17
2438,2439,0,4,1,"'Son tránsfugas, lo más indigno de la política, se han vendido por un cargo' Y el presidente murciano dice que tanto PSOE como Ciudadanos sólo tienen ansia de poder.",2021-03-17
2439,2440,0,4,1,"-En el PSOE veían ilógico que Yolanda Díaz ocupara una vicepresidencia de mayor rango, ya que Nadia Calviño preside la Comisión de asuntos económicos.",2021-03-16
2440,2441,0,4,1,"En el PSOE ven ilógico que Yolanda Díaz ocupe ese puesto cuando Nadia Calviño Preside, también se habla de presiones.",2021-03-16
2441,2442,0,4,1,"Desde el PSOE veían ilógico que Díaz estuviera por encima de Calviño, ahora será vicepresidenta segunda y seguirá al frente de la comisión delegada de Asuntos económicos TVE también ha confirmado que en el Ejecutivo entrará Ione Belarra como ministra de Derechos Sociales.",2021-03-16
2442,2443,0,4,1,"Según ese sondeo, el PSOE volvería a ganar las elecciones generales, con más ventaja respecto al PP, que cedería terreno.",2021-03-16
2443,2444,0,4,1,"La iniciativa de ERC, Junts, el PDECAT y la CUP previsiblemente no saldrá adelante porque el PSOE ya ha dicho que no les apoyará.",2021-03-16
2444,2445,0,4,1,"Ha empezado hoy en Huelva y la diferencia está en que por primera vez junto a 13 agricultores se sientan también en el banquillo los ex alcaldes de Almonte, Francisco Bella del PSOE y José Antonio Domínguez del PP.",2021-03-16
2445,2446,0,4,1,"Ahora, el objetivo es echar a Ayuso dicen algo que comparten desde el PSOE que no entra a valorar la decisión de Más Madrid.",2021-03-16
2446,2447,0,4,1,"En cualquier caso no va a cambiar el rumbo de la coalición, ni la relación entre PSOE y PODEMOS.",2021-03-16
2447,2448,0,4,1,"Según ese sondeo, el PSOE volvería a ganar las elecciones generales, con más ventaja respecto al PP, que cedería terreno.",2021-03-16
2448,2449,0,4,1,El PSOE ya ha adelantado que no la va a apoyar.,2021-03-16
2449,2450,0,4,1,"Se sientan en el banquillo dos exalcaldes, uno del PP y otro del PSOE, y 13 agricultores para quienes el fiscal pide penas de 2 a casi 4 años.",2021-03-16
2450,2451,0,4,1,La segunda se le escapó por los pelos y también por las discrepancias con las ministras del ala económica del PSOE.,2021-03-15
2451,2452,0,4,1,-El principal escollo para que haya un acuerdo entre Unidas Podemos y el PSOE es la participación del sr. Iglesias.,2021-03-15
2452,2453,0,4,1,"Se conocía media hora después de que el PSOE ratificara a su candidato, Ángel Gabilondo.",2021-03-15
2453,2454,0,4,1,Silencio del PSOE tras el anuncio en privado hablan de movimiento inesperado.,2021-03-15
2454,2455,0,4,1,-El principal escollo para que haya un acuerdo entre Unidas Podemos y el PSOE es la participación del sr. Iglesias en el Gobierno.,2021-03-15
2455,2456,0,4,1,Y toda esta crisis tiene su origen en la moción de censura de Murcia que presentaron Ciudadanos y PSOE contra el popular López Miras.,2021-03-15
2456,2457,0,4,1,"Explica que a las 12:25 del pasado miércoles, Díaz Ayuso firmó el documento de disolución de la Asamblea, con el objetivo de celebrar nuevos comicios, y que no fue hasta las 13:03 y las 13:07 cuando se presentaron las mociones de censura de Más Madrid y PSOE.",2021-03-14
2457,2458,0,4,1,"Desde Izquierda Unida, animan a presentar una candidatura única entre las fuerzas que se posicionan a la izquierda del PSOE.",2021-03-14
2458,2459,0,4,1,"Y en la Región de Murcia, la moción de censura de PSOE y Ciudadanos contra el presidente Fernando López Miras, se debatirá y votará el miércoles y jueves de esta semana aunque podría no prosperar.",2021-03-14
2459,2460,0,4,1,Los afiliados del PSOE han votado hoy el acuerdo con Ciudadanos.,2021-03-14
2460,2461,0,4,1,"A la espera de que se pronuncie el Tribunal, el PSOE sigue hoy de precampaña.",2021-03-14
2461,2462,0,4,1,La formación los ha echado y se ha reunido con el PSOE para intentar sacarla adelante a pesar de todo.,2021-03-13
2462,2463,0,4,1,"Si votan con PSOE y Ciudadanos, podrían hacer caer el Gobierno de Murcia.",2021-03-13
2463,2464,0,4,1,"Si el Tribunal da la razón a los letrados de la Asamblea, que solicitaron medidas cautelarísimas, la convocatoria de elecciones quedará paralizada y se llevarán a cabo las mociones de censura contra Ayuso, que presentaron el PSOE y Más Madrid.",2021-03-13
2464,2465,0,4,1,Ciudadanos ya les ha expulsado del partido y avanza con el PSOE para poner fecha a la moción.,2021-03-13
2465,2466,0,4,1,"El partido de Inés Arrimadas ha expulsado a los diputados disidentes y se reúne con el PSOE para, a pesar de todo, intentar sacar adelante la moción.",2021-03-13
2466,2467,0,4,1,"La moción de censura del PSOE y el partido naranja contra López Miras sigue en pie aunque de momento no parece que vaya a salir adelante precisamente, por esta toma de posesión.",2021-03-13
2467,2468,0,4,1,A PSOE y Ciudadanos ya no le salen las cuentas para sacar adelante la moción.,2021-03-12
2468,2469,0,4,1,"48 horas separan la imagen de arriba, la de PSOE y Ciudadanos presentando su moción de censura en Murcia, con de la de abajo, el presidente López Miras, del PP, con su vicepresidenta, de Ciudadanos, anunciando hoy que la moción no saldrá adelante.",2021-03-12
2469,2470,0,4,1,"La moción de censura de ciudadanos y PSOE peligraba. dicen que se han rendido los 3 diputados, que serán los diputados de la asamblea regional los que decidan.",2021-03-12
2470,2471,0,4,1,"López miras, exige a ciudadanos y PSOE que retiren la moción de censura posiblemente no se debata a la moción de censura la próxima semana Pese a los rumores desde anoche, Ciudadanos aseguraba a primera hora tenerlo todo atado y bien atado.",2021-03-12
2471,2472,0,4,1,PSOE y Ciudadanos lo niegan.,2021-03-12
2472,2473,0,4,1,"Después de una mañana en la que las direcciones nacionales de PSOE, CS y PP solo han reaccionado a través de las redes sociales esta tarde Ciudadanos ha convocado de urgencia una ejecutiva nacional para el lunes una reunión que reclamaban miembros destacados de la formación.",2021-03-12
2473,2474,0,4,1,"El PSOE anuncia que Ángel Gabilondo volverá a ser su candidato, si hay elecciones.",2021-03-12
2474,2475,0,4,1,"Con la vista puesta en si hay elecciones, Ángel Gabilondo ya ha dicho que repetirá como candidato del Psoe.",2021-03-12
2475,2476,0,4,1,"Cuando el miércoles PSOE y CS anunciaron la moción de censura contra el PP, sumaban justo los 23 escaños necesarios para la mayoría absoluta.",2021-03-12
2476,2477,0,4,1,"Cuando Ciudadanos y PSOE presentaron la moción de censura, López Miras cesó a varios consejeros de la formación naranja.",2021-03-12
2477,2478,0,4,1,"Y todo, sólo 48 horas después de este momento, cuando PSOE y Ciudadanos presentaran su moción Con un efecto dominó que llegó hasta Madrid.",2021-03-12
2478,2479,0,4,1,"No se esperaba esta maniobra en el PSOE, algunas voces dentro de las filas socialistas, creen que arrimadas debería mover ficha.",2021-03-12
2479,2480,0,4,1,"El PSOE adelanta que su candidato, si hay elecciones volverá a ser Ángel Gabilondo.",2021-03-12
2480,2481,0,4,1,La clave está en saber qué prevalece: la convocatoria de elecciones o las mociones de PSOE y Más Madrid.,2021-03-11
2481,2482,0,4,1,Las dudas surgen porque el propio aludido lo ha dejado en el aire y fuentes del PSOE no garantizan que sea él.,2021-03-11
2482,2483,0,4,1,"Esta misma tarde la ejecutiva regional de la formación naranja se ha reunido para afirmar que Castilla y León no tiene nada que ver con Murcia, que no habrá sorpresas y que ninguno de sus doce procuradores apoyarán la moción de censura presentada por el PSOE.",2021-03-11
2483,2484,0,4,1,"El Congreso ha aprobado la reforma impulsada por el PSOE y Unidas Podemos para que el Poder Judicial no pueda hacer nombramientos cuando esté en funciones, como ocurre ahora.",2021-03-11
2484,2485,0,4,1,"Ha salido adelante con el apoyo de PSOE, Unidas Podemos y el resto de partidos de la izquierda, 189 votos, frente a los 151 en contra de PP, Vox, Ciudadanos, UPN y Foro Asturias.",2021-03-11
2485,2486,0,4,1,Ahora la norma pasa al Senado donde el PSOE quiere que se tramite por vía urgente para que esté en vigor el Primero de Mayo.,2021-03-11
2486,2487,0,4,1,"Villacís que mantiene su alianza con José Luis Martínez Almeida en la capital, ha reprochado a Casado la decisión de la presidenta madrileña ante la posibilidad de que PSOE y Podemos gobiernen en la comunidad.",2021-03-11
2487,2488,0,4,1,"El presidente de Castilla y León, Alfonso Fernández Mañueco, del PP y su vicepresidente, Francisco Igea, de Ciudadanos han comparecido juntos para escenificar su unidad de gobierno frente a la moción de censura presentada por el PSOE.",2021-03-11
2488,2489,0,4,1,Una de las preguntas que planea es quién será el candidato del PSOE en Madrid si finalmente hay elecciones.,2021-03-11
2489,2490,0,4,1,"Y en Murcia, la moción de censura de PSOE y Ciudadanos contra el popular López Miras, la que desató toda la tormenta política de ayer, podría debatirse el próximo miércoles.",2021-03-11
2490,2491,0,4,1,"Ciudadanos y PSOE, continúan hasta ahora, y se sabe que el partido naranja, podría ostentar las consejerías de agricultura y trabajo.",2021-03-11
2491,2492,0,4,1,"-Si no tomo esta decisión, Ciudadanos y el PSOE hubieran presentado una moción de censura, algo que ya han hablado en reiteradas ocasiones, y causar el desastre de la Comunidad de Madrid.",2021-03-10
2492,2493,0,4,1,Díaz Ayuso temía en Madrid una moción como la que presentaban a primera hora en Murcia PSOE y Ciudadanos para hacer caer el ejecutivo de PP y Ciudadanos.,2021-03-10
